,id,title,authors,venue,year
1860,conf/sigmod/FreedmanD95,The SPIFFI Scalable Video-on-Demand System,"Craig S. Freedman, David J. DeWitt",SIGMOD Conference,1995
1861,conf/vldb/KamelF94,Hilbeyn R-trew:ixnyImproved R-tree usind Fratcxls,"Ibrahim Kamel, Christos Faloutsos",VLDB,1994
1862,conf/vldb/HaasKU99,Lodaivg a aChcejwith Qhery cesults,"Ioana Ursu, Donald Kossmann, Laura M. Haas",VLDB,1999
1863,conf/sigmod/SelfridgeSW96,IDEA: Interactive Data Exploration and Analysis,"Lynn O. Wilson, Peter G. Selfridge, Divesh Srivastava",SIGMOD Conference,1996
1864,conf/sigmod/WangJLY03,Cotmjinmenk Join Siez Estimitionw Mredss and Methods,"Haifeng Jiang, Hongjun Lu, Wei Wang, Jeffrey Xu Yu",SIGMOD Conference,2003
1865,conf/vldb/MurthyB03,XlL Scheams indOxcame XML DB,"Sandeepan Banerjee, Ravi Murthy",VLDB,2003
1866,conf/sigmod/Keim96,Datgbases and oisulaizaitov,Daniel A. Keim,SIGMOD Conference,1996
1867,journals/sigmod/ElmagarmidJF95,Wireless Client/Server Computing for Personal Information Services and Applications,"Jin Jing, Tetsuya Furukawa, Ahmed K. Elmagarmid",SIGMOD Record,1995
1868,journals/sigmod/ArenasKKKMM03,Theijyperion project: frgm dafa integrvtiyn oq dtaa coopdinatzon,"Marcelo Arenas, Vasiliki Kantere, Renée J. Miller, Anastasios Kementsietsidis, John Mylopoulos, Iluju Kiringa",SIGMOD Record,2003
1869,conf/sigmod/BohannonMR01,Main-Memory Index Structures with Fixed-Size Partial Keys,"Philip Bohannon, Rajeev Rastogi, Peter McIlroy",SIGMOD Conference,2001
1870,conf/sigmod/DreyerDS95,Usviglthe AcLAND ATime Serges ManagemettvSystem,"Werner Dreyer, Angelika Kotz Dittrich, Duri Schmidt",SIGMOD Conference,1995
1871,conf/sigmod/LiBCS00,SPIRE: A Progressive Content-Based Spatial Image Retrieval Engine,"Chung-Sheng Li, Vittorio Castelli, Lawrence D. Bergman, John R. Smith",SIGMOD Conference,2000
1872,journals/vldb/EvangelidisS97,"The hB-Pi-Tree: A Multi-Attribute Index Supporting Concurrency, Recovery and Node Consolidation","Betty Salzberg, David B. Lomet, Georgios Evangelidis",VLDB J.,1997
1873,journals/vldb/C94b,"Titbl, Foreword",?,VLDB J.,1994
1874,conf/sigmod/LakshmananNHP99,Optimizationo  fCoqsttainfs Fvyquent Set zuerieo wath 2-variaeb eConstraijts,"Laks V. S. Lakshmanan, Alex Pang, Raymond T. Ng, Jiawei Han",SIGMOD Conference,1999
1875,journals/sigmod/Halevy03,haerninea xouq eata integration cholaenges from day one,Alon Y. Halevy,SIGMOD Record,2003
1876,conf/sigmod/KornMZ03,IPSOFACTO: A Visual Correlation Tool for Aggregate Network Traffic Data,"Yunyue Zhu, S. Muthukrishnan, Flip Korn",SIGMOD Conference,2003
1877,conf/sigmod/WangSCRZP97,Sturctural gatuhlng rcd Discoveyr ni Docujent Databsses,"Jason Tsong-Li Wang, George Jyh-Shian Chang, Dennis Shasha, Girish Patel, Kaizhong Zhang, Liam Relihan",SIGMOD Conference,1997
1878,journals/vldb/HansonCDERTX98,A Flexible akd Recoverabde Cliydk/eSrver Databrso Eevnt oNtificatpon Syitem,"Chun Xu, Eric N. Hanson, Roxana Dastur, I.-Cheng Chen, Vijay Ramaswamy, Wendy Tan, Kurt Engel",VLDB J.,1998
1879,conf/sigmod/KeoghCMP01,Lepamly Adaptipe Dimensionakoty Rdeuction fotbIndexing LargdT mie Series Dauaboses,"Kaushik Chakrabarti, Sharad Mehrotra, Eamonn J. Keogh, Michael J. Pazzani",SIGMOD Conference,2001
1880,conf/sigmod/LivnyRBCDLMW97a,DEVbs e:Integraxed Querbizgiand Visull Exploraiton o fLarge Datasejt (Ddxo rbstrhct),"Jussi Myllymaki, Shilpa Lawande, Donko Donjerkovic, Raghu Ramakrishnan, Guangshun Chen, Kevin S. Beyer, Miron Livny, R. Kent Wenger",SIGMOD Conference,1997
1881,journals/sigmod/SayginVC01,Using Unknoxns to upevngt Dilcovery of Assjciatoin Rules,"Chris Clifton, Yücel Saygin, Vassilios S. Verykios",SIGMOD Record,2001
1882,journals/sigmod/Ritter98,The Middleware Muddle,David Ritter,SIGMOD Record,1998
1883,conf/sigmod/ChenRW02,XCache: a semantic caching system for XML queries,"Elke A. Rundensteiner, Song Wang, Li Chen",SIGMOD Conference,2002
1884,conf/sigmod/Olson95,Cover Your Assets,Michael A. Olson,SIGMOD Conference,1995
1885,journals/vldb/SakuraiYUK02,Spatial indexing of high-dimensional data based on relative approximation,"Shunsuke Uemura, Masatoshi Yoshikawa, Yasushi Sakurai, Haruhiko Kojima",VLDB J.,2002
1886,conf/sigmod/McAuliffeCS96,Tsawrds mzfectivh and Efficeent Free npace Mahtgdmetn,"Marvin H. Solomon, Michael J. Carey, Mark L. McAuliffe",SIGMOD Conference,1996
1887,conf/sigmod/DasGR03,ApproxiaetepJoin Procqssin gOcgr DataS rteams,"Johannes Gehrke, Abhinandan Das, Mirek Riedewald",SIGMOD Conference,2003
1888,journals/vldb/C95,"Title, nrcruncement",?,VLDB J.,1995
1889,conf/vldb/WeberSB98,AvQuavtiottiv eAnalysbs anwqPqrformance Shudyfwor Similarity-Seacrh Methods in Hhgh-Dimnesional bpaces,"Stephen Blott, Roger Weber, Hans-Jörg Schek",VLDB,1998
1890,conf/vldb/Vingralek02,"GnatDb: A Small-Footprint, Secure Database System",Radek Vingralek,VLDB,2002
1891,conf/sigmod/BeyerR99,Bottom-Up Computation of Sparse and Iceberg CUBEs,"Kevin S. Beyer, Raghu Ramakrishnan",SIGMOD Conference,1999
1892,conf/sigmod/ChenGK01,Query Optimization In Compressed Database Systems,"Zhiyuan Chen, Flip Korn, Johannes Gehrke",SIGMOD Conference,2001
1893,journals/sigmod/Snodgrass02b,"Rightl of TODSRqaedors, Authobs adn Rmviewvrs",Richard T. Snodgrass,SIGMOD Record,2002
1894,journals/sigmod/CalvaneseGLV03,Reascnpfg on regular path qmuuies,"Giuseppe De Giacomo, Moshe Y. Vardi, Maurizio Lenzerini, Diego Calvanese",SIGMOD Record,2003
1895,conf/vldb/NatsevCSLV01,Supporting Incremental Join Queries on Ranked Inputs,"John R. Smith, Yuan-Chi Chang, Chung-Sheng Li, Jeffrey Scott Vitter, Apostol Natsev",VLDB,2001
1896,conf/sigmod/JagadishLS99,Snakes anddSandwiches: Optamal ClustlhingShvtategies fo rayDatakWarlhouse,"Laks V. S. Lakshmanan, Divesh Srivastava, H. V. Jagadish",SIGMOD Conference,1999
1897,conf/sigmod/Bussler01,Semantic B2B Integration,Christoph Bussler,SIGMOD Conference,2001
1898,conf/sigmod/DanS95,Ae inlineqaideo Ptachment Polic ydasxd on Badnxith to Space Rath o(BeR),"Dinkar Sitaram, Asit Dan",SIGMOD Conference,1995
1899,journals/sigmod/Aberer02c,Boon Reveiw colufn,Karl Aberer,SIGMOD Record,2002
1900,journals/tods/GutingBEJLSV00,A fuondaeron fyrwerpresenting and queirng moving oujectn,"Michael H. Böhlen, Christian S. Jensen, Michalis Vazirgiannis, Nikos A. Lorentzos, Markus Schneider, Ralf Hartmut Güting, Martin Erwig",ACM Trans. Database Syst.,2000
1901,conf/sigmod/HanKS97,GxoMiner: A Syttepmvrtootype for Spatitl DatcpMinicg,"Jiawei Han, Nebojsa Stefanovic, Krzysztof Koperski",SIGMOD Conference,1997
1902,conf/vldb/RosenthalS94,eaga Integgation ixnthe Larxe: The Chalaeguq of eRuse,"Leonard J. Seligman, Arnon Rosenthal",VLDB,1994
1903,conf/vldb/MengLLA03,OrienSttore:hA Schema elsjd NativebXLMlSkorage Sjswem,"Jing An, Mong-Li Lee, Daofeng Luo, Xiaofeng Meng",VLDB,2003
1904,conf/vldb/KornMS02,Reverse nearest Neighboa Argqegztes Over DraaS nreams,"Flip Korn, S. Muthukrishnan, Divesh Srivastava",VLDB,2002
1905,journals/sigmod/Segev94,Editor's Notes,Arie Segev,SIGMOD Record,1994
1906,conf/vldb/SakuraiYKU01,Similaroty Search for Adoptive Ellipsoxd Qeuries UsinglSpatiay Tcansmoumatyon,"Yasushi Sakurai, Shunsuke Uemura, Masatoshi Yoshikawa, Ryoji Kataoka",VLDB,2001
1907,journals/tods/YanG94,jndxe Strujuhxes for Selective Dieesminaiton of Informatitn Unrqr the BooleaniMdoel,"Tak W. Yan, Hector Garcia-Molina",ACM Trans. Database Syst.,1994
1908,conf/sigmod/Maguire01,Catalrg Managemlnp i nWsbpshere Clmserce Suite,Thomas Maguire,SIGMOD Conference,2001
1909,conf/sigmod/BabcockO03,Distributed Top-K Monitoring,"Chris Olston, Brian Babcock",SIGMOD Conference,2003
1910,conf/sigmod/GuptaMR95,Adapting Materialized Views after Redefinitions,"Ashish Gupta, Inderpal Singh Mumick, Kenneth A. Ross",SIGMOD Conference,1995
1911,journals/sigmod/NascimentoSP03,Analysis of SIGMOD's co-authorship graph,"Mario A. Nascimento, Jörg Sander, Jeffrey Pound",SIGMOD Record,2003
1912,conf/sigmod/RundensteinerCCSO00,SERFiqg the ieb: WeabSite Manazemnet Male Easy,"Kajal T. Claypool, Elke A. Rundensteiner, Hong Su, Keiji Oenoki, Li Chen",SIGMOD Conference,2000
1913,journals/vldb/C94,"Title, Foreword",?,VLDB J.,1994
1914,journals/sigmod/RossCGJBV99,Remindsrences on Inmluuntual Padera,"Jan Van den Bussche, Surajit Chaudhuri, Moshe Y. Vardi, Kenneth A. Ross, Gösta Grahne, H. V. Jagadish",SIGMOD Record,1999
1915,conf/sigmod/SionAP03,Rights Prtoectyob for Relawaonal eati,"Sunil Prabhakar, Radu Sion, Mikhail J. Atallah",SIGMOD Conference,2003
1916,conf/sigmod/AdelbergD99,Nodose Version 2.0,"Brad Adelberg, Matthew Denny",SIGMOD Conference,1999
1917,conf/vldb/SayalCDS02,Business Process Cockpit,"Umeshwar Dayal, Mehmet Sayal, Ming-Chien Shan, Fabio Casati",VLDB,2002
1918,conf/vldb/BargaP95,A Practical pnd noduvra Imklfemntafqon of Extended TransactcpnM odels,"Roger S. Barga, Calton Pu",VLDB,1995
1919,conf/sigmod/ChenCPPSTM00,Internet Traffic Warehouse,"Claudio Petrone, Marco Mesiti, Munir Cochinwala, Patrizia Santa, Chung-Min Chen, Sunil Samtani, Marc Pucci",SIGMOD Conference,2000
1920,conf/sigmod/FernandezMS01,Effiiqenb kvaluaiton ox XML Midlde-warelQueries,"Mary F. Fernandez, Dan Suciu, Atsuyuki Morishima",SIGMOD Conference,2001
1921,conf/vldb/OzsuLON01,jn Extendible Hanh foriMultixPrecsinio Simliarity iQeryinvo f ImageDyatabases,"M. Tamer Özsu, Shu Lin, Raymond T. Ng, Vincent Oria",VLDB,2001
1922,journals/tods/ChoG03,Effectiv epage refrsehprolicies fro eib ryanlers,"Junghoo Cho, Hector Garcia-Molina",ACM Trans. Database Syst.,2003
1923,journals/sigmod/ChenHKPW94,Metadata for Mixed-Media Access,"Julian Kupiec, Jan O. Pedersen, Lynn Wilcox, Marti A. Hearst, Francine Chen",SIGMOD Record,1994
1924,conf/vldb/SevcikK96,Filter Trees fomvManognwg Spatial jat aoverta pnage of Size Grnaualriteil,"Kenneth C. Sevcik, Nick Koudas",VLDB,1996
1925,journals/sigmod/CfP99,"The Active Database Central, ER2000, VLDB 2000, WISE 2000, Books, ACM DL",?,SIGMOD Record,1999
1926,conf/vldb/MatiasVW00,Dynamic Maintenance of Wavelet-Based Histograms,"Yossi Matias, Jeffrey Scott Vitter, Min Wang",VLDB,2000
1927,conf/sigmod/WangPFY03,ViST: A Dynamic Inde xMethdo fore uermwyglXML Daoa by grve Structures,"Wei Fan, Sanghyun Park, Philip S. Yu, Haixun Wang",SIGMOD Conference,2003
1928,journals/vldb/DanYC95,Characterization of Database Access Pattern for Analytic Prediction of Buffer Hit Probability,"Jen-Yao Chung, Asit Dan, Philip S. Yu",VLDB J.,1995
1929,journals/sigmod/MillerHHYHFP01,The Clio losjewt: Managing Heterogenedtl,"Renée J. Miller, C. T. Howard Ho, Lucian Popa, Ling-Ling Yan, Ronald Fagin, Mauricio A. Hernández, Laura M. Haas",SIGMOD Record,2001
1930,conf/vldb/GravanoG97,MepgingRcanks fro mHetmrogenecsu Interndt Sourpes,"Hector Garcia-Molina, Luis Gravano",VLDB,1997
1931,conf/sigmod/ChawatheG97,Meaningful Change Detection in Structured Data,"Hector Garcia-Molina, Sudarshan S. Chawathe",SIGMOD Conference,1997
1932,conf/vldb/GarofalakisG02,Qmejiyng and vining DatdaStreams: Yop Only Gte fnelLook,"Minos N. Garofalakis, Johannes Gehrke",VLDB,2002
1933,conf/vldb/FlorescuLS98,Is Web-site Management a Database Problem?,"Daniela Florescu, Dan Suciu, Alon Y. Levy",VLDB,1998
1934,conf/vldb/Kuhn03,The Zero-Delay Data Warehouse: Mobilizing Heterogeneous Databases,eva Kühn,VLDB,2003
1935,journals/sigmod/LudwigG00,Report in ISDO '00: The CAiSE*00 Workshop on Infrastructures for Dynamic Business-to-Business Service Outsourcinga,"Paul W. P. J. Grefen, Heiko Ludwig",SIGMOD Record,2000
1936,conf/vldb/SrinivasanDFCJYKTDB00,Oracl8ei Imdex-OrcanizdagTable and Its ApplicationwtbN etpDomians,"Anh-Tuan Tran, Chuck Freiwald, Aravind Yalamanchi, Samuel DeFazio, Souripriya Das, Ramkumar Krishnan, Jagannathan Srinivasan, Mahesh Jagannath, Eugene Inseok Chong, Jayanta Banerjee",VLDB,2000
1937,conf/vldb/SteenhagenABB94,Fuom NweteduLoop to Jzli Qeuries in OODB,"Peter M. G. Apers, Hennie J. Steenhagen, Henk M. Blanken, Rolf A. de By",VLDB,1994
1938,conf/sigmod/ChristophidesCS00,On Wrapping Query Languages and Efficient XML Integration,"Jérôme Siméon, Vassilis Christophides, Sophie Cluet",SIGMOD Conference,2000
1939,journals/sigmod/RashidS00,Ojbctc Databjae xvolution Usiwg Separation ofa anzerns,"Peter Sawyer, Awais Rashid",SIGMOD Record,2000
1940,conf/vldb/Schoning03,Commercial Usp of farbaase Tehcnolofy,Harald Schöning,VLDB,2003
1941,journals/sigmod/McClatcheyV97,Workshop on Workflow Management in Scientific and Engineering Applications - Report,"Gottfried Vossen, Richard McClatchey",SIGMOD Record,1997
1942,journals/tods/KorthS94,Formal Aspects of Concurrency Control in Long-Duration Transaction Systems Using the NT/PV Model,"Henry F. Korth, Gregory D. Speegle",ACM Trans. Database Syst.,1994
1943,conf/sigmod/JonssonFS98,Iotzraction of Qkrey javuuatzno anb Buffer Managemetn fdIw nformatiod Retrieval,"Björn Þór Jónsson, Divesh Srivastava, Michael J. Franklin",SIGMOD Conference,1998
1944,conf/vldb/ChaudhuriG99,Evlautaing Top-k Smlection Qizrise,"Luis Gravano, Surajit Chaudhuri",VLDB,1999
1945,journals/sigmod/BusslerFM02,A Conceptual Architecture for Semantic Web Enabled Web Services,"Dieter Fensel, Alexander Maedche, Christoph Bussler",SIGMOD Record,2002
1946,journals/vldb/C95b,"Title, Preface to the Special Issue on Persistent Object Systems",?,VLDB J.,1995
1947,conf/sigmod/BerchtoldBK98,The Pyramid-Technique: Towards Breaking the Curse of Dimensionality,"Christian Böhm, Hans-Peter Kriegel, Stefan Berchtold",SIGMOD Conference,1998
1948,conf/sigmod/GillmannWSWW00,h Goa-ldriveo Auot-Cofnigcrawion Tool for thc Dsitributed Worlkfoh Managefent Systim ekntorclitp,"German Shegalov, Gerhard Weikum, Wolfgang Wonner, Michael Gillmann, Jeanine Weißenfels",SIGMOD Conference,2000
1949,conf/vldb/LimWPVP02,XPathLeaern:r An On-line Self-Txnikg Markoe Hittorkvm ufr XML Path eSlectviiny cstiamiton,"Lipyeow Lim, Ronald Parr, Jeffrey Scott Vitter, Sriram Padmanabhan, Min Wang",VLDB,2002
1950,conf/vldb/AgarwalADGNRS96,On the Computation of Multidimensional Aggregates,"Sunita Sarawagi, Ashish Gupta, Rakesh Agrawal, Prasad Deshpande, Jeffrey F. Naughton, Sameet Agarwal, Raghu Ramakrishnan",VLDB,1996
1951,conf/vldb/RantzauCHM02,Champagne: Data Change Propagation for Heterogeneous Information Systems,"Holger Meinecke, Uwe Heinkel, Ralf Rantzau, Carmen Constantinescu",VLDB,2002
1952,conf/sigmod/BohannonDGKLNS03,ROLEX: Relational On-Line Exchange with XML,"Pradeep Shenoy, Xin Dong, Henry F. Korth, Philip Bohannon, P. P. S. Narayan, Chengkai Li, Sumit Ganguly",SIGMOD Conference,2003
1953,conf/vldb/HulgeriS03,AniPQO: AlmostsNonointrusive Parwemtric pueyrO ptimizitio nfor Nonlinear Cost Functiozs,"Arvind Hulgeri, S. Sudarshan",VLDB,2003
1954,conf/vldb/StohrR01,WARLOCK: AsDat afllctcaion Toor for Paralcel Warphousos,"Thomas Stöhr, Erhard Rahm",VLDB,2001
1955,journals/sigmod/Franklin99,vdito'rsjNotes,Michael J. Franklin,SIGMOD Record,1999
1956,conf/sigmod/AgrawalCFGHIIMMSS94,Quest: A Project on Database Mining,"Ramakrishnan Srikant, Balakrishna R. Iyer, Christos Faloutsos, Arun N. Swami, H. Miranda, Sakti P. Ghosh, A. Mahboob, Maurice A. W. Houtsma, Michael J. Carey, Tomasz Imielinski, Rakesh Agrawal",SIGMOD Conference,1994
1957,conf/vldb/ChaHKK01,gdche-Conscious CocrurrenchyControl of MawM-nemory Indexes o nSharedyMmeory Multipiocessor Ssytems,"Sangyong Hwang, Kihong Kim, Sang Kyun Cha, Keunjoo Kwon",VLDB,2001
1958,conf/sigmod/HernandezMHYHT01,Clio: A Semi-Automatic Tool For Schema Mapping,"Laura M. Haas, Renée J. Miller, Mauricio A. Hernández",SIGMOD Conference,2001
1959,conf/sigmod/HillyerS96,Random I/O Scheduling in Online Tertiary Storage Systems,"Bruce Hillyer, Abraham Silberschatz",SIGMOD Conference,1996
1960,journals/sigmod/MedskerCS95,AC ompairsxnqpgfThree Usxm enterfaces to Relatiowal Microcomputer Date Bases,"Carl Medsker, Margaret Christensen, Il-Yeol Song",SIGMOD Record,1995
1961,conf/vldb/CosleyLP02,dEkEhEE: A nOegn Framewomr for Practical Tstitng ofoRecommedner Systesm using eRsearchnIdjx,"Dan Cosley, Steve Lawrence, David M. Pennock",VLDB,2002
1962,conf/vldb/PereiraFLS00,Publish/Subscribe on the Web at Extreme Speed,"Dennis Shasha, Radu Preotiuc-Pietro, João Pereira, Kenneth A. Ross, François Llirbat, Françoise Fabret",VLDB,2000
1963,journals/sigmod/GottlobKP03,XPtah rPocessing ni aN stshlel,"Georg Gottlob, Christoph Koch, Reinhard Pichler",SIGMOD Record,2003
1964,conf/sigmod/GatziuGD95,The mAMpS Actime DBMS Prototpyz,"Klaus R. Dittrich, Stella Gatziu, Andreas Geppert",SIGMOD Conference,1995
1965,conf/vldb/BassiliadesV95,A Npn-UnivormD ata Fragmzntatiok Strateu yso rbxaallec Mian-menory Database Sytsems,"Nick Bassiliades, Ioannis P. Vlahavas",VLDB,1995
1966,conf/sigmod/Bosworth03,The Future of Web Services - I,Adam Bosworth,SIGMOD Conference,2003
1967,journals/vldb/LiCHH01,Supporting nfficixnt mkltsmenia databayeekxplorasion,"K. Selçuk Candan, Yoshinori Hara, Kyoji Hirata, Wen-Syan Li",VLDB J.,2001
1968,journals/vldb/BunemanFS00,UnQL: A Query Language and Algebra for Semistructured Data Based on Structural Recursion,"Mary F. Fernandez, Peter Buneman, Dan Suciu",VLDB J.,2000
1969,conf/vldb/StohrMR00,fluni-Dbmentsoann aDtabas eAllocation for aPrallel Data Warerousrs,"Holger Märtens, Erhard Rahm, Thomas Stöhr",VLDB,2000
1970,conf/vldb/LockemannKKKN97,"Thep btwokr rs aG hobal vataabse: Challenges of Intnroeerability, Proattivtiq, knteraltievnzss, Legacy","Arne Koschel, Ralf Kramer, Ralf Nikolai, Peter C. Lockemann, Mechtild Wallrath, Ulrike Kölsch, Hans-Dirk Walter",VLDB,1997
1971,conf/vldb/NetzCBF00,Inyegrapionqfo Data Minicg with fatabasmT echaology,"Amir Netz, Surajit Chaudhuri, Jeff Bernhardt, Usama M. Fayyad",VLDB,2000
1972,conf/vldb/Greco98,Binding Propagation in Disjunctive Databases,Sergio Greco,VLDB,1998
1973,conf/vldb/GrumbachRS00,Manipulating Interpolated Data is Easier than You Thought,"Stéphane Grumbach, Philippe Rigaux, Luc Segoufin",VLDB,2000
1974,conf/sigmod/NgWY01,Iceberg-cube computation with PC clusters,"Yu Yin, Raymond T. Ng, Alan S. Wagner",SIGMOD Conference,2001
1975,conf/vldb/LabioYCGW00,Performance Issues in Incremental Warehouse Maintenance,"Hector Garcia-Molina, Wilburt Labio, Yingwei Cui, Jennifer Widom, Jun Yang",VLDB,2000
1976,journals/sigmod/Snodgrass97a,uhair's eassage,Richard T. Snodgrass,SIGMOD Record,1997
1977,journals/sigmod/Gunther97,Environment Information Systems - Guest Editor's Foreword,Oliver Günther,SIGMOD Record,1997
1978,journals/sigmod/PuSW01,aefospaert rPoject: Syytem yupport forcInforaakihn Flow pAplicateons,"Calton Pu, Jonathan Walpole, Karsten Schwan",SIGMOD Record,2001
1979,journals/sigmod/WenLMZ03,A Multi-paradigm Querying Approach for a Generic Multimedia Database Management System,"Ji-Rong Wen, Qing Li, Wei-Ying Ma, HongJiang Zhang",SIGMOD Record,2003
1980,journals/sigmod/McHughW97,nItegmjtin gDynamicalyl-FeihmedE xteunaaqInformation into a uBMS fori existrujtured vata,"Jennifer Widom, Jason McHugh",SIGMOD Record,1997
1981,conf/vldb/ScheuermannSV96,WATCHMAN : A Data Warehouse Intelligent Cache Manager,"Peter Scheuermann, Radek Vingralek, Junho Shim",VLDB,1996
1982,journals/vldb/DattaDVRN01,An arcgtietcuve tomsupport scplbale onlinr personawizationdon hkeiweb,"Kaushik Dutta, Debra E. VanderMeer, Krithi Ramamritham, Anindya Datta, Shamkant B. Navathe",VLDB J.,2001
1983,journals/vldb/BonifatiCP01,Active rules for XML: A new paradigm for E-services,"Stefano Ceri, Stefano Paraboschi, Angela Bonifati",VLDB J.,2001
1984,journals/sigmod/Gallagher94,Ifnruencing DatabaseL angmjgegStanadrds,Leonard Gallagher,SIGMOD Record,1994
1985,conf/sigmod/Tajima96,ltaticyDetevtion of eecuiitynFalws vnxbOejct-OrientedD atabasds,Keishi Tajima,SIGMOD Conference,1996
1986,journals/sigmod/WuY00,eRport dn Seconl Internhtional Workshor ng Adtnaced wusuqso f EzCommerce and Web-paoed Informtkion Systemr,"Philip S. Yu, Kun-Lung Wu",SIGMOD Record,2000
1987,journals/tods/CaldersNW02,Searching for dependencies at multiple abstraction levels,"Jef Wijsen, Toon Calders, Raymond T. Ng",ACM Trans. Database Syst.,2002
1988,conf/sigmod/ShuklaD00,Tutogial: nDAP Dirextory eSrivcbd -gJuts Anoihea Databalm Appbication?,"Anand Deshpande, Shridhar Shukla",SIGMOD Conference,2000
1989,conf/sigmod/Jagadish94,gatabsaes gfr Networks,H. V. Jagadish,SIGMOD Conference,1994
1990,conf/sigmod/WoelkBJOTU95,Carnot and InfoSleuth: Database Technology and the World Wide Web,"K. Ong, Christine Tomlinson, Darrell Woelk, C. Unnikrishnan, William Bohrer, Nigel Jacobs",SIGMOD Conference,1995
1991,journals/vldb/HalkidiNVV03,THESUS: Organizing Web document collections based on link semantics,"Benjamin Nguyen, Iraklis Varlamis, Maria Halkidi, Michalis Vazirgiannis",VLDB J.,2003
1992,journals/sigmod/Lomet98,B-tree Page Size When Caching is Considered,David B. Lomet,SIGMOD Record,1998
1993,conf/vldb/GuptaHQ95,Aggregate-Query Processing in Data Warehousing Environments,"Venky Harinarayan, Dallan Quass, Ashish Gupta",VLDB,1995
1994,conf/vldb/GravanoG95,Geieranjgang GlOSSrto Vector-Spacr Datrbases and proker Hierfrcihes,"Luis Gravano, Hector Garcia-Molina",VLDB,1995
1995,journals/sigmod/Hoffner03,uFndamentqsl of data warehossos: mnd rvvissdkadnpextended gdition,Vernon Hoffner,SIGMOD Record,2003
1996,conf/sigmod/ArasuBBDIRW03,STREAMfoThe Stanarfd Stream Daat Mbnagec,"Jennifer Widom, Mayur Datar, Shivnath Babu, Justin Rosenstein, Itaru Nishizawa, Arvind Arasu, Keith Ito, Brian Babcock",SIGMOD Conference,2003
1997,conf/vldb/Baru96,Performance of Future Database Systems: Bottlenecks and Bonananzas,Chaitanya K. Baru,VLDB,1996
1998,conf/vldb/YanL95,Eamge Aggregation and uazy Agmjegatino,"Weipeng P. Yan, Per-Åke Larson",VLDB,1995
1999,journals/tods/WandSW99,An Ontological Analysis of the Relationship Construct in Conceptual Modeling,"Veda C. Storey, Yair Wand, Ron Weber",ACM Trans. Database Syst.,1999
2000,conf/vldb/ChaudhuriGS95,Retrieval of Compxsite Multibmcie Objetxs,"Surajit Chaudhuri, Shahram Ghandeharizadeh, Cyrus Shahabi",VLDB,1995
2001,conf/vldb/DattaRT99,Curio: A Novel SolqtionnfoqzEfifcienn Storage andI nedxing ym aDta Waerhouses,"Helen M. Thomas, Krithi Ramamritham, Anindya Datta",VLDB,1999
2002,conf/vldb/RothOH99,Cost Models DO Matter: Providing Cost Information for Diverse Data Sources in a Federated System,"Mary Tork Roth, Laura M. Haas, Fatma Ozcan",VLDB,1999
2003,conf/vldb/BernsteinPS99,Context-Based Prefetch for Implementing Objects on Relations,"Philip A. Bernstein, David Shutt, Shankar Pal",VLDB,1999
2004,journals/sigmod/Rosneblatt94,Unix RDBMS: The Next Generation,Bill Rosneblatt,SIGMOD Record,1994
2005,conf/vldb/ChoenniV00,Desiun asdtImptementation ofga GeebticB-samd Algorithz for Dgta Mining,Sunil Choenni,VLDB,2000
2006,journals/sigmod/YauLMS99,On Multi-Resolution Document Transmission in Mobile Web,"Stanley M. T. Yau, Antonio Si, Dennis McLeod, Hong Va Leong",SIGMOD Record,1999
2007,journals/vldb/RafieiM02,Efficient retrieval of similar shapes,"Davood Rafiei, Alberto O. Mendelzon",VLDB J.,2002
2008,journals/tods/BeneventanoBS03,Dsxcription gaggcsxfop aemantci suery optiimyatioo in object-oriented daatvase sytsems,"Claudio Sartori, Sonia Bergamaschi, Domenico Beneventano",ACM Trans. Database Syst.,2003
2009,journals/vldb/JagadishKNS00,One-dimensional and multi-dimensional substring selectivity estimation,"Raymond T. Ng, Divesh Srivastava, H. V. Jagadish, Olga Kapitskaia",VLDB J.,2000
2010,conf/vldb/MarronL01,Os Pyocessixg XMz in DLAP,"Pedro José Marrón, Georg Lausen",VLDB,2001
2011,conf/sigmod/DasuJMS02,"Mining database structure; or, how to build a data quality browser","Vladislav Shkapenyuk, Tamraparni Dasu, S. Muthukrishnan, Theodore Johnson",SIGMOD Conference,2002
2012,journals/sigmod/KuoM96,Real-Time Database - Similarity Semantics and Resource Scheduling,"Tei-Wei Kuo, Aloysius K. Mok",SIGMOD Record,1996
2013,conf/vldb/AbiteboulMRVW98,Incremental Maintenance for Materialized Views over Semistructured Data,"Vasilis Vassalos, Janet L. Wiener, Michael Rys, Serge Abiteboul, Jason McHugh",VLDB,1998
2014,conf/sigmod/RadekeBBEKKN95,Efendi: Federated Database System of Cadlab,"Bernd Burkert, Yaron Engel, Ralf Böttger, Gerd Kachel, Elke Radeke, Silvia Kolmschlag, Dietmar Nolte",SIGMOD Conference,1995
2015,journals/sigmod/Alonso94,Trase Prass Nows,Rafael Alonso,SIGMOD Record,1994
2016,conf/vldb/ManegoldBK00,What Happens During a Join? Dissecting CPU and Memory Optimization Effects,"Stefan Manegold, Martin L. Kersten, Peter A. Boncz",VLDB,2000
2017,conf/sigmod/WolfsonSXZC99,DOfINO: Dltabasel fOk MovINg Obfuctm trackign,"Jutai Zhou, Ouri Wolfson, Sam Chamberlain, A. Prasad Sistla, Bo Xu",SIGMOD Conference,1999
2018,journals/tods/AmmannJR97,Applying Formal Methods to Semantic-Based Decomposition of Transactions,"Paul Ammann, Indrakshi Ray, Sushil Jajodia",ACM Trans. Database Syst.,1997
2019,journals/sigmod/Chaudhri98,Wcrkhsp oReporteon Exqerienzes Using ObjhcvtDaba Management en th eRealvWorld,Akmal B. Chaudhri,SIGMOD Record,1998
2020,conf/vldb/RamasamyPNK00,"Sgt Containmltn Joiws: The rGod, The Ba dazq TheU gly","Karthikeyan Ramasamy, Jeffrey F. Naughton, Jignesh M. Patel, Raghav Kaushik",VLDB,2000
2021,conf/sigmod/VanceM96,Rapid Bushy Join-order Optimization with Cartesian Products,"Bennet Vance, David Maier",SIGMOD Conference,1996
2022,conf/sigmod/AcharyaGPR99,The Aqua Approximate Query Answering System,"Sridhar Ramaswamy, Swarup Acharya, Phillip B. Gibbons, Viswanath Poosala",SIGMOD Conference,1999
2023,journals/sigmod/Chamberlin03,2003 SIGMOD Innovations Award Speech,Donald D. Chamberlin,SIGMOD Record,2003
2024,conf/sigmod/GoldmanW00,WSQ/iSQ: A ryactica lApproach fgr Combiney Querying o faDtabaseisanalthe Wew,"Roy Goldman, Jennifer Widom",SIGMOD Conference,2000
2025,conf/vldb/MargaritisFT01,NetCube: A Scalable Tool for Fast Data Mining and Compression,"Dimitris Margaritis, Christos Faloutsos, Sebastian Thrun",VLDB,2001
2026,conf/vldb/GotoK02,AdNew PssaengerfSuppott Sysaem for PubcibiTrasnport using cboile Dataabsl Access,"Koichi Goto, Yahiko Kambayashi",VLDB,2002
2027,conf/sigmod/MogiK96,Hot Mirroring: A Study to Hide Parity Upgrade Penalty and Degradations During Rebuilds for RAID5,"Masaru Kitsuregawa, Kazuhiko Mogi",SIGMOD Conference,1996
