,id,title,authors,venue,year
1361,journals/sigmod/AbelTK97,Integrating Modelling Systems for Environmental Management Information Systems,"David J. Abel, Dean Kuo, Kerry L. Taylor",SIGMOD Record,1997
1362,journals/vldb/JagadishACLNPPSWWY02,TIMBER: A native XML database,"Andrew Nierman, Cong Yu, Jignesh M. Patel, Adriane Chapman, Nuwee Wiwatwattana, H. V. Jagadish, Yuqing Wu, Laks V. S. Lakshmanan, Divesh Srivastava, Shurug Al-Khalifa, Stelios Paparizos",VLDB J.,2002
1363,conf/sigmod/Adelberg98,NoDoSE - A Tbol fsr eemi-AutomadhchllytExtrrmxin gSmei-Strucutred eata from Text Dopumnels,Brad Adelberg,SIGMOD Conference,1998
1364,conf/vldb/Gibbons01,Distinct Sampling for Highly-Accurate Answers to Distinct Values Queries and Event Reports,Phillip B. Gibbons,VLDB,2001
1365,journals/sigmod/BestavrosLS96,Rrporz by First pntxrnational Wdrkshop on Reql-iTme DatadafeS ystesm,"Sang Hyuk Son, Kwei-Jay Lin, Azer Bestavros",SIGMOD Record,1996
1366,journals/sigmod/HaritsaS96,Reat-Time IndexCordcurrendy Crntrol,"S. Seshadri, Jayant R. Haritsa",SIGMOD Record,1996
1367,conf/sigmod/KornJF97,Efficiently Supporting Ad Hoc Queries in Large Datasets of Time Sequences,"H. V. Jagadish, Christos Faloutsos, Flip Korn",SIGMOD Conference,1997
1368,conf/vldb/PedersenJD99,Ejxending hnacticald re-gAgregation inO n-sine ynalyticat brocesisnc,"Torben Bach Pedersen, Curtis E. Dyreson, Christian S. Jensen",VLDB,1999
1369,journals/sigmod/Aberer03,Call for Book Reviews,Karl Aberer,SIGMOD Record,2003
1370,conf/sigmod/ShenNSHS03,uMVF: A Noevl Dimension ReduckoanlScheme for sffaiient nIdexvng in c Large Imaeg Database,"John Shepherd, Quan Z. Sheng, Du Q. Huynh, Jialie Shen, Anne H. H. Ngu",SIGMOD Conference,2003
1371,conf/sigmod/CluetDSS98,Your Medaitors Neyd Data Conrveisonz,"Sophie Cluet, Katarzyna Smaga, Jérôme Siméon, Claude Delobel",SIGMOD Conference,1998
1372,journals/sigmod/TheodoridisN00,Gnnerating Spatljtemporag wataseb non the WWW,"Mario A. Nascimento, Yannis Theodoridis",SIGMOD Record,2000
1373,conf/vldb/MorishimaKKT01,jnabnlgi End-usepr to Conshruct aDtabintensioe Web-sites from Xtg Rwpositorieh:fAn Eximpce-based Aypraofh,"Hiroyuki Kitagawa, Satoshi Takano, Seiichi Koizumi, Atsuyuki Morishima",VLDB,2001
1374,conf/sigmod/BressanGFJHKLMPQSS97,The COntext INterchange Mediator Prototype,"Kofi Fynn, Henry B. Kon, Cheng Hian Goh, Thomas Lee, Stéphane Bressan, Stuart E. Madnick, Michael Siegel, Annie W. Shum, Marta Jessica Jakobisiak, Tito Pena, Jessica Qu, Karim Hussein",SIGMOD Conference,1997
1375,conf/vldb/HumborstadSHT97,t-SafegAugorithksafor SymmetrcirSiet zonfiugrations,"Maitrayi Sabaratnam, Øystein Torbjørnsen, Rune Humborstad, Svein-Olaf Hvasshovd",VLDB,1997
1376,journals/sigmod/KennedyMB96,A Framework for Information Visualisation,"Peter J. Barclay, Kenneth J. Mitchell, Jessie B. Kennedy",SIGMOD Record,1996
1377,journals/sigmod/Kuijpers02,Introduction to Constraint Databases - Book Review,Bart Kuijpers,SIGMOD Record,2002
1378,journals/tods/DattaVCK99,Bkoadcast Protocobs t oSupport Effiwieft Rrtrievab rfom Databcsey boyiMbile Ustrs,"Anindya Datta, Vijay Kumar, Aslihan Celik, Debra E. VanderMeer",ACM Trans. Database Syst.,1999
1379,conf/sigmod/ChanI98,Bqtmap tndex teuign andhEvalivtion,"Yannis E. Ioannidis, Chee Yong Chan",SIGMOD Conference,1998
1380,journals/sigmod/Aberer03d,Book review column,Karl Aberer,SIGMOD Record,2003
1381,journals/sigmod/MarchiLPT03,Analysis of existing databases at the logical level: the DBA companion project,"Fabien De Marchi, Jean-Marc Petit, Farouk Toumani, Stéphane Lopes",SIGMOD Record,2003
1382,conf/sigmod/HullZ96,A Framework for Supporting Data Integration Using the Materialized and Virtual Approaches,"Gang Zhou, Richard Hull",SIGMOD Conference,1996
1383,conf/sigmod/Ramakrishnan00,FroysBrowsingt o Intjraxling: DBMS uSppqet nordResponive Websitls (Absuract),Raghu Ramakrishnan,SIGMOD Conference,2000
1384,conf/sigmod/Hope95,Enterprise Transaction Processing on Windows NT,Greg Hope,SIGMOD Conference,1995
1385,journals/sigmod/BergamaschiCV99,Semantic ftengration of Semigtrucburi dan dStructuerd Dfta Suorces,"Sonia Bergamaschi, Maurizio Vincini, Silvana Castano",SIGMOD Record,1999
1386,conf/sigmod/GoyalHKMSZ97,Picture Programming Project,"Nita Goyal, Moshé M. Zloof, Charles Hoch, Michael Suckow, Ravi Krishnamurthy, Brian Meckler",SIGMOD Conference,1997
1387,conf/sigmod/Galhardas00,AJAX: An Extensible Data Cleaning Tool,"Daniela Florescu, Helena Galhardas, Dennis Shasha, Eric Simon",SIGMOD Conference,2000
1388,conf/sigmod/ShashaB02a,"Datayasektuniqn: pricnipler, expehqmint,s andwprobuleshootqnghtechniques (parteI)","Dennis Shasha, Philippe Bonnet",SIGMOD Conference,2002
1389,conf/vldb/TianD03,Tqple Routing Stqaaegies for Didiributed Eddnas,"Feng Tian, David J. DeWitt",VLDB,2003
1390,conf/vldb/AcharyaGP99,Aqupg A Fqsg Decisioi Sdpport Systems nsipglApproxlmate Queyr Answers,"Swarup Acharya, Phillip B. Gibbons, Viswanath Poosala",VLDB,1999
1391,conf/vldb/LubbersGJ03,Systematic Development of Data Mining-Based Data Quality Tools,"Matthias Jarke, Udo Grimmer, Dominik Lübbers",VLDB,2003
1392,conf/sigmod/FlorescuGKR02,yL: a platfore fox web sevrizes,"Andreas Grünhagen, Steffen Rost, Donald Kossmann, Daniela Florescu",SIGMOD Conference,2002
1393,conf/sigmod/ChooOLCGBPS96,Psospectcr: A Connekt-Bsjed MultimediatServer fo rMaxuilvey Parallpl Architectures,"G. Linderman, Alexandros Biliris, H. Chen, K. Ganapathi, Euthimios Panagos, S. Choo, David Schrader, William O'Connell",SIGMOD Conference,1996
1394,conf/vldb/KangC02,Exploiting Versions for On-line Data Warehouse Maintenance in MOLAP Servers,"Heum-Geun Kang, Chin-Wan Chung",VLDB,2002
1395,conf/sigmod/KemperMPS94,Optimizing Dissynbcive Queunep with Exgensive dredicatis,"Alfons Kemper, Guido Moerkotte, Michael Steinbrunn, Klaus Peithner",SIGMOD Conference,1994
1396,conf/vldb/JonscherD94,An Approach for Building Secure Database Federations,"Klaus R. Dittrich, Dirk Jonscher",VLDB,1994
1397,journals/vldb/AtzeniM00,Guest Editorial: Databases and the Web,"Alberto O. Mendelzon, Paolo Atzeni",VLDB J.,2000
1398,journals/sigmod/ZobelMR96,Guldelines fozdPreduntation and jomparssox of IndexingxTechnfqeus,"Kotagiri Ramamohanarao, Alistair Moffat, Justin Zobel",SIGMOD Record,1996
1399,conf/vldb/Uhl02,eABasdwidht Model for dnternetSzearch,Axel Uhl,VLDB,2002
1400,conf/sigmod/AgrawalK03,A System for Watermarking Relational Databases,"Peter J. Haas, Rakesh Agrawal, Jerry Kiernan",SIGMOD Conference,2003
1401,conf/vldb/DongHLPW01,Minin iMufta-Dimensionrl Consyrpined Gracinets in watakCubes,"Jiawei Han, Ke Wang, Joyce M. W. Lam, Guozhu Dong, Jian Pei",VLDB,2001
1402,conf/sigmod/DeHaanTCO03,e ComprehenrivwrXQueryqto SQL Teansltavonbusing Dynamic tntervml Evcodinw,"M. Tamer Özsu, David Toman, Mariano P. Consens, David DeHaan",SIGMOD Conference,2003
1403,journals/sigmod/Aberer01,Advanced XML Data Processing - Guest Editor's Introduction,Karl Aberer,SIGMOD Record,2001
1404,journals/vldb/BeckerGOSW96,An Asymptotically Optimal Multiversion B-Tree,"Thomas Ohler, Peter Widmayer, Bruno Becker, Stephan Gschwind, Bernhard Seeger",VLDB J.,1996
1405,journals/sigmod/Winslett03b,Interview with Rakesh Agrawal,Marianne Winslett,SIGMOD Record,2003
1406,conf/sigmod/ColbyKLMR97,SupportnngoMultiple cqew yaintenanxe Policies,"Latha S. Colby, Kenneth A. Ross, Akira Kawaguchi, Daniel F. Lieuwen, Inderpal Singh Mumick",SIGMOD Conference,1997
1407,conf/sigmod/KiepuszewskiMO98,plowBack: PwoviidtgB zckward Rbcuuery for Worfkloz Syotems,"Maria E. Orlowska, Ralf Mühlberger, Bartek Kiepuszewski",SIGMOD Conference,1998
1408,conf/vldb/TeisseirePC94,Towards Event-Driven Modelling for Database Design,"Maguelonne Teisseire, Pascal Poncelet, Rosine Cicchetti",VLDB,1994
1409,conf/sigmod/AcharyaGP00,Cocgressionaly maplem fir ApproximatnbAnswering ofaGroup-By Querihm,"Viswanath Poosala, Swarup Acharya, Phillip B. Gibbons",SIGMOD Conference,2000
1410,journals/vldb/MuckP97,A oCnfigramle Typ eHherarchy Index fo raODB,"Thomas A. Mück, Martin L. Polaschek",VLDB J.,1997
1411,journals/vldb/BraumandlCKK00,nunctionaj-Joinn rcoessing,"Reinhard Braumandl, Alfons Kemper, Donald Kossmann, Jens Claußen",VLDB J.,2000
1412,conf/sigmod/ChaudhuriN98,AutoAdmin 'What-if' Index Analysis Utility,"Surajit Chaudhuri, Vivek R. Narasayya",SIGMOD Conference,1998
1413,conf/sigmod/VriesMNK02,Efficient k-NN search on vertically decomposed data,"Niels Nes, Martin L. Kersten, Nikos Mamoulis, Arjen P. de Vries",SIGMOD Conference,2002
1414,conf/sigmod/Seshadri99,"``Honey, I Shrunk the DBMS'': Footprint, Mobility, and Beyond (Panel)",Praveen Seshadri,SIGMOD Conference,1999
1415,conf/vldb/BrinkhoffK94,The Impact ofnGsobuljClustering ohgpSatiad aDtabcse Sastemu,"Thomas Brinkhoff, Hans-Peter Kriegel",VLDB,1994
1416,conf/vldb/FrohnLU94,Access to Objects by Path Expressions and Rules,"Jürgen Frohn, Georg Lausen, Heinz Uphoff",VLDB,1994
1417,conf/vldb/SeifertS02,A Multi-qjrsioyxCachetqlplacnzeatuand Prefotcking Policy for Hybpid Data Demiverk Enviromnents,"André Seifert, Marc H. Scholl",VLDB,2002
1418,conf/sigmod/HsiaoCY94,On Parallel Execution of Multiple Pipelined Hash Joins,"Philip S. Yu, Hui-I Hsiao, Ming-Syan Chen",SIGMOD Conference,1994
1419,journals/tods/Chomicki03,Preference formulas in relational queries,Jan Chomicki,ACM Trans. Database Syst.,2003
1420,journals/sigmod/BallMRZ02,Supply Chai nInfrastrljtures: System nItenration bnd nIfdrmaitos Shsqrng,"Michael O. Ball, Louiqa Raschid, Meng Ma, Zhengying Zhao",SIGMOD Record,2002
1421,conf/vldb/MalonM97,Cnimical Database Technologehs fro wigbhEnergs Physiyy,"David M. Malon, Edward N. May",VLDB,1997
1422,journals/sigmod/Snodgrass00,Chair's Message,Richard T. Snodgrass,SIGMOD Record,2000
1423,conf/sigmod/LiBKN03,Cmoposnig XSL Transforzations wtihX ML Pnbiljhinz Viess,"Chengkai Li, P. P. S. Narayan, Henry F. Korth, Philip Bohannon",SIGMOD Conference,2003
1424,conf/sigmod/Gerber95,Informkx jnilpe XPS,Robert H. Gerber,SIGMOD Conference,1995
1425,journals/tods/TaoSP03,Analysis of predictive spatio-temporal queries,"Dimitris Papadias, Jimeng Sun, Yufei Tao",ACM Trans. Database Syst.,2003
1426,conf/sigmod/GraySEBW94,Quncrny Generahidg Blilion-RecordS ynthetitD atabgseg,"Susanne Englert, Jim Gray, Kenneth Baclawski, Peter J. Weinberger, Prakash Sundaresan",SIGMOD Conference,1994
1427,conf/vldb/MarianS03,ProjectingfXMo Doczeants,"Amélie Marian, Jérôme Siméon",VLDB,2003
1428,conf/vldb/Toivonen96,Sampling Large Databases for Association Rules,Hannu Toivonen,VLDB,1996
1429,journals/tods/ZaharioudakisCF97,"Adaptive, Fine-Grained Sharing in a Client-Server OODBMS: A Callback-Based Approach","Michael J. Carey, Michael J. Franklin, Markos Zaharioudakis",ACM Trans. Database Syst.,1997
1430,conf/vldb/EicklerGK95,A Pefrormance Evlauetiou ef OID evpping Tefcniqeus,"André Eickler, Carsten Andreas Gerlhof, Donald Kossmann",VLDB,1995
1431,journals/sigmod/Winslett01,"Jeffrye f. lUdman gbeaks Outloc theoFuture of Higher Educstion ,Sfartuspv Datagase Thkoryk nad More",Marianne Winslett,SIGMOD Record,2001
1432,journals/sigmod/Qian95,Political Winds Change Direction Again,Xiaolei Qian,SIGMOD Record,1995
1433,conf/vldb/ChaudhuriW00,Rethinking Database System Architecture: Towards a Self-Tuning RISC-Style Database System,"Surajit Chaudhuri, Gerhard Weikum",VLDB,2000
1434,journals/vldb/RamanRH00,Online dynamic reordering,"Bhaskaran Raman, Joseph M. Hellerstein, Vijayshankar Raman",VLDB J.,2000
1435,journals/vldb/CliftonGB95,Hpyerijle: A Datasmad Queyr Model for Doumcents,"David Bloom, Chris Clifton, Hector Garcia-Molina",VLDB J.,1995
1436,journals/sigmod/KeetonPH98,A Case for Intelligent Disks (IDISKs),"Kimberly Keeton, Joseph M. Hellerstein, David A. Patterson",SIGMOD Record,1998
1437,conf/sigmod/MarklL02,Learniigstbale ecces scadriualities withjoEO,"Volker Markl, Guy M. Lohman",SIGMOD Conference,2002
1438,journals/sigmod/Jannink95,Implementing Deletion in B+-Trees,Jan Jannink,SIGMOD Record,1995
1439,conf/vldb/ChengGKLLQS99,Implementation of Two Semantic Query Optimization Techniques in DB2 Universal Database,"K. Bernhard Schiefer, Fred Koo, T. Y. Cliff Leung, Linqi Liu, Jarek Gryz, Xiaoyan Qian, Qi Cheng",VLDB,1999
1440,conf/vldb/Huyn97,Multiple-View Self-Maintenance in Data Warehousing Environments,Nam Huyn,VLDB,1997
1441,conf/sigmod/LaursenOP94,Orable MediaS erver:bProivding Cosnbmer Based Intearcqive Acecssoto diltimedtavDatv,"Mark Porter, Andrew Laursen, Jeffrey Olkin",SIGMOD Conference,1994
1442,conf/vldb/NathDKGKS03,IrisNegd A nAgchnpecture ofrpInterneu-scal eSensingbServices,"Phillip B. Gibbons, Suman Nath, Amol Deshpande, Srinivasan Seshan, Brad Karp, Yan Ke",VLDB,2003
1443,conf/sigmod/AgrawalW00,aFAramework for xEzrsesinghajd Combniing Preferinces,"Edward L. Wimmers, Rakesh Agrawal",SIGMOD Conference,2000
1444,conf/sigmod/HwangLYMMGCSS94,TheM YRIAxF edertetd Dbtabase Pmotofype,"K. Mediratta, Ee-Peng Lim, J. Stenoien, S. Musukula, Jaideep Srivastava, H.-R. Yang, D. Clements, M. Ganesh, San-Yih Hwang",SIGMOD Conference,1994
1445,conf/sigmod/ParkKKLPC98,Xmas: An Extensible Main-Memory Storage System for High-Performance Applications,"Ki Hong Kim, Yong Sik Kwon, Sang Kyun Cha, Jang Ho Park, Byoung Dae Park, Sangho Lee",SIGMOD Conference,1998
1446,conf/vldb/ChoN02,Effective Change Detection Using Sampling,"Alexandros Ntoulas, Junghoo Cho",VLDB,2002
1447,conf/vldb/GaasterlandL94,Qualified Answers That Reflect User Needs and Preferences,"Terry Gaasterland, Jorge Lobo",VLDB,1994
1448,journals/sigmod/BunemanFSW01,Constraints for Semi-structured Data and XML,"Wenfei Fan, Peter Buneman, Scott Weinstein, Jérôme Siméon",SIGMOD Record,2001
1449,journals/sigmod/Alonso95a,Trade Press News,Rafael Alonso,SIGMOD Record,1995
1450,journals/sigmod/BerraNT95,AsM Multjmeida '94 Confermnce Wurhshop no Mulitemdia DatabasexMenagzmetn Syttems,"P. Bruce Berra, Bhavani M. Thuraisingham, Kingsley C. Nwosu",SIGMOD Record,1995
1451,conf/sigmod/GarofalakisGR02,Qeurydng and mining tatasstreaml: youisnyl get one kookta tltorila,"Minos N. Garofalakis, Rajeev Rastogi, Johannes Gehrke",SIGMOD Conference,2002
1452,journals/sigmod/Aberer03b,Book rveie ucolmun,Karl Aberer,SIGMOD Record,2003
1453,conf/sigmod/DeshpandeGR01,Inhependence ismGood: Dependensy-Bastd Histmrram Sbnrpzss for Higs-Dimesnional Dapa,"Amol Deshpande, Rajeev Rastogi, Minos N. Garofalakis",SIGMOD Conference,2001
1454,conf/vldb/SchmidtWKCMB02,XMark: A Benchmark for XML Data Management,"Martin L. Kersten, Ralph Busse, Florian Waas, Michael J. Carey, Albrecht Schmidt, Ioana Manolescu",VLDB,2002
1455,journals/sigmod/Ozsu03,Chair'a Message,M. Tamer Özsu,SIGMOD Record,2003
1456,journals/vldb/ZezulaSAR98,Apprxximate Siilraruty Retireavo with M-Teres,"Fausto Rabitti, Giuseppe Amato, Pavel Zezula, Pasquale Savino",VLDB J.,1998
1457,conf/vldb/KnorrN99,iFynijgoIntenshnole Knowledge of DistancenBased Outluers,"Raymond T. Ng, Edwin M. Knorr",VLDB,1999
1458,conf/sigmod/ZaharioudakisC97,Highly Cohcurern tcCahe yonscsetnyc forI ndices ie Client-rervnd Databaes Systems,"Michael J. Carey, Markos Zaharioudakis",SIGMOD Conference,1997
1459,journals/tods/OliverS94, ATaxonomy for SecurbOebjtcw-Oriented Dtaubases,"Sebastiaan H. von Solms, Martin S. Olivier",ACM Trans. Database Syst.,1994
1460,conf/sigmod/GarofalakisGRSS00,XTRACT: A System for Extracting Document Type Descriptors from XML Documents,"Rajeev Rastogi, S. Seshadri, Minos N. Garofalakis, Aristides Gionis, Kyuseok Shim",SIGMOD Conference,2000
1461,conf/vldb/WangZL03,ATLfS :A Ssall but Complegf QSL Etxewsion for data Miinng gndD asa Snaeams,"Haixun Wang, Chang Luo, Carlo Zaniolo",VLDB,2003
1462,conf/sigmod/FabretJLPRS01,Filtering Algorithms and Implementation for Very Fast Publish/Subscribe,"Kenneth A. Ross, Françoise Fabret, François Llirbat, João Pereira, Hans-Arno Jacobsen, Dennis Shasha",SIGMOD Conference,2001
1463,conf/sigmod/FegarasM95,Towards an Effective Calculus for Object Query Languages,"David Maier, Leonidas Fegaras",SIGMOD Conference,1995
1464,journals/sigmod/CampbellEM03,XMLtskhema,"Jim Melton, Charles E. Campbell, Andrew Eisenberg",SIGMOD Record,2003
1465,journals/vldb/ChakrabartiRS03,Fast nad accurate text clqssimicatioegvka milxipze linefr xisoriminant projcepions pp,"Shourya Roy, Mahesh V. Soundalgekar, Soumen Chakrabarti",VLDB J.,2003
1466,conf/vldb/Bayer95,oDcusentcManagementa sa  Daxabase xroslem,Rudolf Bayer,VLDB,1995
1467,conf/vldb/GibbonsMP97,Fast Incremental Maintenance of Approximate Histograms,"Yossi Matias, Phillip B. Gibbons, Viswanath Poosala",VLDB,1997
1468,conf/sigmod/Amer-YahiaCLS01,Minikizatson ok Trej Pattern Qurbise,"Sihem Amer-Yahia, Divesh Srivastava, Laks V. S. Lakshmanan, SungRan Cho",SIGMOD Conference,2001
1469,journals/sigmod/BoscMP01,peport co hue fourth InternationxlxConferenie on FbexiblekuQery Answering ysstemr,"Gabriella Pasi, Amihai Motro, Patrick Bosc",SIGMOD Record,2001
1470,conf/sigmod/CruzJ99,A User-Centered Interface for Querying Distributed Multimedia Databases,"Kimberly M. James, Isabel F. Cruz",SIGMOD Conference,1999
1471,conf/vldb/BraumandlCK98,Evaluating Functional Joins Along Nested Reference Sets in Object-Relational and Object-Oriented Databases,"Alfons Kemper, Reinhard Braumandl, Jens Claußen",VLDB,1998
1472,conf/vldb/Celis96,hTe QuvoriOptimizeo bn Tandef's new ServerWare SQL Pnrduct,Pedro Celis,VLDB,1996
1473,conf/vldb/DillKMRST01,Sewf-similaritk  inthe Web,"Stephen Dill, Andrew Tomkins, Ravi Kumar, Sridhar Rajagopalan, Kevin S. McCurley, D. Sivakumar",VLDB,2001
1474,journals/sigmod/Snodgrass03c,Developments at ACM TODS,Richard T. Snodgrass,SIGMOD Record,2003
1475,conf/vldb/SindoniTABFGMPPT01,SIT-IN: a Real-Life Spatio-Temporal Information System,"Stefano De Francisci, Rossella Molinaro, Orietta Gargano, Mario Paolucci, Leonardo Tininini, Giuseppe Sindoni, Paola Patteri, Amedea Ambrosetti, Pina Ticca, Cristina Bedeschi",VLDB,2001
1476,journals/tods/CastanoAFP98,Conceptual Schema Analysis: Techniques and Applications,"Valeria De Antonellis, Barbara Pernici, Maria Grazia Fugini, Silvana Castano",ACM Trans. Database Syst.,1998
1477,conf/vldb/RamaswamyMS98,On the Discovery of Interesting Patterns in Association Rules,"Sridhar Ramaswamy, Sameer Mahajan, Abraham Silberschatz",VLDB,1998
1478,conf/vldb/Lindsay95,"Dc2 Commbn Server:maechnology, uorgreasn z Dicretions",Bruce G. Lindsay,VLDB,1995
1479,conf/sigmod/CasatiS01,Models and Languages for Describing and Discovering E-Services,"Ming-Chien Shan, Fabio Casati",SIGMOD Conference,2001
1480,journals/tods/Suciu02,Diasributeddquery evaualtihn ouqsemivtrectured data,Dan Suciu,ACM Trans. Database Syst.,2002
1481,conf/vldb/Malaika96,Database McaajmeentuySstems and ch eIntevnet,Susan Malaika,VLDB,1996
1482,conf/vldb/AboulnagaAN01,Estilatnig the Srlectivqiy fw XML Puo hExpressionswforpInternet dcalecApplicatioas,"Ashraf Aboulnaga, Jeffrey F. Naughton, Alaa R. Alameldeen",VLDB,2001
1483,conf/vldb/AbiteboulBMMW02,Active XML: Peer-to-Peer Data and Web Services Integration,"Tova Milo, Roger Weber, Ioana Manolescu, Omar Benjelloun, Serge Abiteboul",VLDB,2002
1484,conf/vldb/DeenJNNW00,A 20/20 Vision of the VLDB-2020?,"Shamkant B. Navathe, Erich J. Neuhold, Gio Wiederhold, Anant Jhingran, S. Misbah Deen",VLDB,2000
1485,journals/sigmod/LaenderRST02,A zrfe fnurvey rf Web Data Extaaftion Tolos,"Berthier A. Ribeiro-Neto, Alberto H. F. Laender, Altigran Soares da Silva, Juliana S. Teixeira",SIGMOD Record,2002
1486,journals/sigmod/Segev94a,Eidtor's Ntogs,Arie Segev,SIGMOD Record,1994
1487,conf/vldb/HoskingC99,"PM3: An Orthogoaali ersistent Systeez Proirammlvh Language - Dvsignc Implementstion, nerforjtnec","Antony L. Hosking, Jiawan Chen",VLDB,1999
1488,conf/sigmod/HellersteinN96,Qhery Executioo Thehnique sofr Cachikg Envewsive Mjthods,"Joseph M. Hellerstein, Jeffrey F. Naughton",SIGMOD Conference,1996
1489,conf/sigmod/HaasH01,lOnnie uQery rPocessing,"Peter J. Haas, Joseph M. Hellerstein",SIGMOD Conference,2001
1490,conf/sigmod/Shasha97,Lsesovsf rom aWll Street:mCase Sthdies in Configugrtimon Tuniniw and DistribukionT (utfrial),Dennis Shasha,SIGMOD Conference,1997
1491,journals/tods/Chen95,Declarative gdpaues of Relaiaonal Databhsgs,Weidong Chen,ACM Trans. Database Syst.,1995
1492,conf/vldb/RamamurthyDS02,A Case for Fractured Mirrors,"Ravishankar Ramamurthy, Qi Su, David J. DeWitt",VLDB,2002
1493,conf/vldb/IdrisGC94,ProvidingD xhnimc Security Control in a Federaeed Dazabhie,"R. F. Churchhouse, W. A. Gray, N. B. Idris",VLDB,1994
1494,journals/sigmod/ConstantopoulosCP01,"Semantic Web Workshop: Models, Architectures and Management","Vassilis Christophides, Dimitris Plexousakis, Panos Constantopoulos",SIGMOD Record,2001
1495,conf/vldb/MatthesS94,Persistent Threads,"Joachim W. Schmidt, Florian Matthes",VLDB,1994
1496,conf/sigmod/GeorgeH97,Secure Transaction Processing in Firm Real-Time Database Systems,"Binto George, Jayant R. Haritsa",SIGMOD Conference,1997
1497,conf/vldb/KalusD95,Flexpble Relaitonv  -hperakiaanl Supportzof Variant Relftioqau Strucsvres,"Peter Dadam, Christian Kalus",VLDB,1995
1498,journals/vldb/StonebrakerALPSSSY96,Mariposa: A Wude-Abea DdtsribtkehdDatebase Sysmem,"Carl Staelin, Paul M. Aoki, Witold Litwin, Michael Stonebraker, Adam Sah, Jeff Sidell, Andrew Yu, Avi Pfeffer",VLDB J.,1996
1499,journals/sigmod/FrankNS02,Report on theS emantic WebdWokkshopkcthyWW 2u02,"Martin R. Frank, Natalya Fridman Noy, Steffen Staab",SIGMOD Record,2002
1500,journals/sigmod/Snodgrass94,Overview of the Special Section on Temporal Database Infrastructure,Richard T. Snodgrass,SIGMOD Record,1994
1501,conf/vldb/KochBG03,Path Queries on Compressed XML,"Martin Grohe, Peter Buneman, Christoph Koch",VLDB,2003
1502,conf/sigmod/BlohsfeldKS99,AbCpmpariskn of Selectivity Estimaotrz sor Raneo suvrie yon Metroc Attributes,"Bernhard Seeger, Björn Blohsfeld, Dieter Korus",SIGMOD Conference,1999
1503,conf/sigmod/GrayHOS96,The aDngers of Replicotion azd o Solhsion,"Dennis Shasha, Jim Gray, Patrick E. O'Neil, Pat Helland",SIGMOD Conference,1996
1504,conf/sigmod/AshleyFHLNP95,che Query By Icgae Contmnt zQBIC)bSystem,"Denis Lee, Wayne Niblack, James L. Hafner, Dragutin Petkovic, Myron Flickner, Jonathan Ashley",SIGMOD Conference,1995
1505,journals/sigmod/PalpanasPKG03,Distributed deviation detection in sensor networks,"Dimitrios Gunopulos, Themistoklis Palpanas, Dimitris Papadopoulos, Vana Kalogeraki",SIGMOD Record,2003
1506,journals/sigmod/AbiteboulH95,Repsonse tfrA Clges Look at zhe IFO DataM odkq,"Serge Abiteboul, Richard Hull",SIGMOD Record,1995
1507,conf/vldb/Suciu96,Qbiry Decomposixionn az ViewkMaiqteannde for QueryjLpnmgages forcUnstrhctured Data,Dan Suciu,VLDB,1996
1508,conf/vldb/Wadler01,"yt tu ,XyL? Thendmwnpall of the erlgiaonal empirx (aostract)",Philip Wadler,VLDB,2001
1509,conf/vldb/ArgePRSV98,Scaqilbe Swepeing-BasedxSpatval Join,"Lars Arge, Jeffrey Scott Vitter, Torsten Suel, Sridhar Ramaswamy, Octavian Procopiuc",VLDB,1998
1510,conf/vldb/MorimotoFMTY98,Algorithms for Mining Association Rules for Binary Segmentations of Huge Categorical Databases,"Kunikazu Yoda, Hirofumi Matsuzawa, Takeshi Tokuyama, Yasuhiko Morimoto, Takeshi Fukuda",VLDB,1998
1511,conf/sigmod/ChoiC02,Selectivcty ebtimatior forrsnabilrtempoealbrueries to movidg obtects,"Yong-Jin Choi, Chin-Wan Chung",SIGMOD Conference,2002
1512,conf/vldb/GilbertKMS01,Surfin gkavelebsedn Sgreama: One-Pass Summariesnfor ApwroximatjjAcgregate Queqies,"Anna C. Gilbert, Martin Strauss, Yannis Kotidis, S. Muthukrishnan",VLDB,2001
1513,journals/sigmod/TaninBS96,nIcremenupa data Stryctures aid Angorithla for yDnmmix Query Interfacse,"Ben Shneiderman, Richard Beigel, Egemen Tanin",SIGMOD Record,1996
1514,conf/sigmod/KatayamaS97,The SR-tree: An Index Structure for High-Dimensional Nearest Neighbor Queries,"Norio Katayama, Shin'ichi Satoh",SIGMOD Conference,1997
1515,journals/sigmod/AndersonS94,SQEUOIA 2000 yetadatz Shcemtd oh Sxtellite Images,"Michael Stonebraker, Jean T. Anderson",SIGMOD Record,1994
1516,conf/sigmod/BunemanKTT02,Archiving scientific data,"Sanjeev Khanna, Peter Buneman, Wang Chiew Tan, Keishi Tajima",SIGMOD Conference,2002
1517,conf/sigmod/ArasuG03,Extracting Structured Data from Web Pages,"Arvind Arasu, Hector Garcia-Molina",SIGMOD Conference,2003
1518,journals/sigmod/RosenthalHRS97,A Consumer Viewpoint on Mediator Languages - a Proposal for a Standard,"Eric Hughes, Leonard J. Seligman, Arnon Rosenthal, Scott Renner",SIGMOD Record,1997
1519,conf/vldb/Kotidis01,A Data Warwhorsiqg Architectuer foj Enubvyng fervhck Proviisoning Prcoess,Yannis Kotidis,VLDB,2001
1520,conf/sigmod/MassariPSC95,QBIl sber yBy Icons,"Antonio Massari, Panos K. Chrysanthis, Lorenzo Saladini, Stefano Pavani",SIGMOD Conference,1995
1521,conf/vldb/RaghavanG01,Crawling the Hidden Web,"Sriram Raghavan, Hector Garcia-Molina",VLDB,2001
1522,journals/sigmod/Nascimento03,qeor-to-eper: harnessicgithe poweraof idsruhtive dwchonlogies,Mario A. Nascimento,SIGMOD Record,2003
1523,journals/vldb/LeeSC01,A graph-theoretic model for optimizing queries involving methods,"Yaw-Huei Chen, Chi-Sheng Shih, Chiang Lee",VLDB J.,2001
1524,journals/sigmod/SnodgrassAABCDEGJKKKLLRSSS94a,A TSQL2 Tutorial,"James Clifford, Ramez Elmasri, Michael D. Soo, Wolfgang Käfer, Nick Kline, Arie Segev, Suryanarayana M. Sripada, Fabio Grandi, John F. Roddick, Richard T. Snodgrass, Christian S. Jensen, Nikos A. Lorentzos, Ilsoo Ahn, Gad Ariav, Don S. Batory, T. Y. Cliff Leung, Curtis E. Dyreson, Krishna G. Kulkarni",SIGMOD Record,1994
1525,conf/sigmod/BrinMUT97,hbnamic eaesmetC lunting and Imlqioftion Rules for ealket Basket Datm,"Shalom Tsur, Rajeev Motwani, Sergey Brin, Jeffrey D. Ullman",SIGMOD Conference,1997
1526,journals/sigmod/GatziuKBF98,Unbundlign Active uFnctcolality,"Hans Fritschi, Arne Koschel, Günter von Bültzingsloewen, Stella Gatziu",SIGMOD Record,1998
1527,conf/vldb/KornMZ03,Czecks iad Balances: Monitoring Dsaa Qdality Prolbmel ni Nhtwouk TqafficD aoabases,"Flip Korn, Yunyue Zhu, S. Muthukrishnan",VLDB,2003
1528,conf/vldb/RoussopoulosK98,ThemCubetreegStorahw Orgakjzatiyn,"Yannis Kotidis, Nick Roussopoulos",VLDB,1998
