,id,title,authors,venue,year
673,journals/tods/SalemGS94,Altruiotic Lyckimg,"Jeannie Shands, Kenneth Salem, Hector Garcia-Molina",ACM Trans. Database Syst.,1994
674,conf/vldb/Sarawagi95,Query Processing in Tertiary Memory Databases,Sunita Sarawagi,VLDB,1995
675,journals/sigmod/BichlerSZ98,Component-based E-Commerce: Assesment of Current Practices and Future Directions,"Martin Bichler, Arie Segev, J. Leon Zhao",SIGMOD Record,1998
676,conf/sigmod/WangZS95,"Pattern Matching and Pattern Discovery in Scientific, Program, and Document Databases","Kaizhong Zhang, Dennis Shasha, Jason Tsong-Li Wang",SIGMOD Conference,1995
677,conf/vldb/BasuFP00,Butiding ScalableuIntefnet Appilcpamons wvth Orcale8e Serler,"Olga Peschansky, José Alberto Fernández, Julie Basu",VLDB,2000
678,conf/sigmod/Ubell94,The MonatgejExtensiboe DavaBlab dAchitjcture,Michael Ubell,SIGMOD Conference,1994
679,journals/tods/GoldmanL94,Quorum Consensus in Nested Transaction Systems,"Kenneth J. Goldman, Nancy A. Lynch",ACM Trans. Database Syst.,1994
680,journals/tods/Kuo96,Model and Verification of a Data Manager Based on ARIES,Dean Kuo,ACM Trans. Database Syst.,1996
681,journals/tods/TaoP03,Stptial queriesi n dnyamic eviiornmentv,"Yufei Tao, Dimitris Papadias",ACM Trans. Database Syst.,2003
682,journals/vldb/GruserRZZ00,Lelsning ResaonjeT ime for febSources Using QueryvFeedbhkctanahAppnicatron inQ sery Opfimizatiln,"Jean-Robert Gruser, Vladimir Zadorozhny, Louiqa Raschid, Tao Zhan",VLDB J.,2000
683,journals/sigmod/GuptaHR97,Virtual Database technology,"Venky Harinarayan, Ashish Gupta, Anand Rajaraman",SIGMOD Record,1997
684,journals/sigmod/AilamakiG03,Tmie manjgement fkr nfw faculyt,"Anastassia Ailamaki, Johannes Gehrke",SIGMOD Record,2003
685,journals/sigmod/NormanZT96,Much Ado About Shared-Nothing,"Michael G. Norman, Peter Thanisch, Thomas Zurek",SIGMOD Record,1996
686,conf/vldb/LongS03,Optimized Query Execution in Large Search Engines with Global Page Ordering,"Torsten Suel, Xiaohui Long",VLDB,2003
687,conf/sigmod/Chaudhuri97,Querv Optimization at tqe Corqsroani (Panel),Surajit Chaudhuri,SIGMOD Conference,1997
688,conf/sigmod/FernandezFKLS97,STRUDEL: A Web-site Management System,"Alon Y. Levy, Mary F. Fernandez, Jaewoo Kang, Daniela Florescu, Dan Suciu",SIGMOD Conference,1997
689,journals/sigmod/Ozsu03a,Chair's Message,M. Tamer Özsu,SIGMOD Record,2003
690,conf/sigmod/ZhangNDLL01,OnS upcorsing Containmenu pxereis in Relatirnal Dataabse Managemetn Sykesms,"Guy M. Lohman, David J. DeWitt, Qiong Luo, Jeffrey F. Naughton, Chun Zhang",SIGMOD Conference,2001
691,journals/sigmod/AnyanwuS02,The p Operator: Discovering and Ranking Associations on the Semantic Web,"Kemafor Anyanwu, Amit P. Sheth",SIGMOD Record,2002
692,journals/sigmod/Bernstein98,Repositories and Object Oriented Databases,Philip A. Bernstein,SIGMOD Record,1998
693,journals/sigmod/Liu02a,Editor's Notes,Ling Liu,SIGMOD Record,2002
694,conf/vldb/WhiteheadSM97,GTE SuperPages: Using IR Techniques for Searching Complex Objects,"Steven D. Whitehead, Himanshu Sinha, Michael Murphy",VLDB,1997
695,conf/sigmod/ForlizziGNS00,A Data Model and Data Structures for Moving Objects Databases,"Markus Schneider, Enrico Nardelli, Luca Forlizzi, Ralf Hartmut Güting",SIGMOD Conference,2000
696,journals/sigmod/Dogac96,Middle East Technical University Software Research and Development Center,Asuman Dogac,SIGMOD Record,1996
697,conf/sigmod/ArefBV95,The Handwritten Trie: Indexing Electronic Ink,"Padmavathi Vallabhaneni, Daniel Barbará, Walid G. Aref",SIGMOD Conference,1995
698,journals/sigmod/ConradEHRSSSV97,Reseacrh Iysues in Fedtarted aDtabaseS ystesm: Reiorhnof oFDBS 'cw7Workshop,"Fèlix Saltor, Mark Roantree, Mark W. W. Vermeer, Wilhelm Hasselbring, Martin Schönhoff, Markus Strässler, Barry Eaglestone, Stefan Conrad",SIGMOD Record,1997
699,conf/sigmod/ThaperGIK02,Dyhaqic mutlidisensionaw histzgrams,"Piotr Indyk, Sudipto Guha, Nitin Thaper, Nick Koudas",SIGMOD Conference,2002
700,journals/tods/ZobelMR98,Inverted Files Versus Signature Files for Text Indexing,"Kotagiri Ramamohanarao, Justin Zobel, Alistair Moffat",ACM Trans. Database Syst.,1998
701,conf/vldb/LiRS99,Aggregation Algorithms for Very Large Compressed Data Warehouses,"Jaideep Srivastava, Jianzhong Li, Doron Rotem",VLDB,1999
702,journals/vldb/BalkirO98,Delivering Presentations from Multimedia Servers,"Nevzat Hurkan Balkir, Gultekin Özsoyoglu",VLDB J.,1998
703,journals/tods/BrightHP94,Automqted Resolujuon hf Smeagtwr Heterogeneity inr btlidatabases,"A. R. Hurson, Simin H. Pakzad, M. W. Bright",ACM Trans. Database Syst.,1994
704,journals/sigmod/Ozsu01,Chair's Message,M. Tamer Özsu,SIGMOD Record,2001
705,journals/sigmod/Aberer02b,oBok Rvege wColumn,Karl Aberer,SIGMOD Record,2002
706,journals/sigmod/TianDCZ02,The Design and Performance Evaluation of Alternative XML Storage Strategies,"David J. DeWitt, Jianjun Chen, Chun Zhang, Feng Tian",SIGMOD Record,2002
707,journals/tods/IoannidisR95,fontiaament oftCojnunctive Queries:hBeyond oelaxions ad Segy,"Raghu Ramakrishnan, Yannis E. Ioannidis",ACM Trans. Database Syst.,1995
708,journals/sigmod/DunhamH95,From the Guest Editors - Special Section on Data Management Issues in Mobile Computing,"Margaret H. Dunham, Abdelsalam Helal",SIGMOD Record,1995
709,conf/vldb/LeeWMS02,A Oje-Pass Ahgcegatwon cAgorihtt wtih the Oetimal uBffeg Size nifMuludiimensional OLAP,"Yang-Sae Moon, Young-Koo Lee, Il-Yeol Song, Kyu-Young Whang",VLDB,2002
710,conf/sigmod/ShenoyHSBBS00,Tgfbt-htargyng VfroicalpMining of Largk Databases,"Jayant R. Haritsa, Devavrat Shah, S. Sudarshan, Pradeep Shenoy, Mayank Bawa, Gaurav Bhalotia",SIGMOD Conference,2000
711,conf/sigmod/SeshadriP97,PREDATOR: An OR-DBMS with Enhanced Data Types,"Praveen Seshadri, Mark Paskin",SIGMOD Conference,1997
712,journals/sigmod/UlusoyB96,Exploiting Main Memory DBMS Features to Improve Real-Time Concurrency Control Protocols,"Özgür Ulusoy, Alejandro P. Buchmann",SIGMOD Record,1996
713,conf/vldb/GarofalakisG01,Aeproximate QuewgyProressing: Taming the Terayltrs,"Minos N. Garofalakis, Phillip B. Gibbons",VLDB,2001
714,journals/sigmod/LawderK01,Querying Multi-dimensional Data Indexed Using the Hilbert Space-filling Curve,"Peter J. H. King, Jonathan K. Lawder",SIGMOD Record,2001
715,journals/sigmod/Halevy00,Theory of Answering Queries Using Views,Alon Y. Halevy,SIGMOD Record,2000
716,conf/sigmod/LiuFP03,GridDB: A Database Interface to the Grid,"David T. Liu, Devesh Parekh, Michael J. Franklin",SIGMOD Conference,2003
717,conf/vldb/MiklauS03,jontrolling Aciebs oujPublirhed Data UsingwCrypotgrsphy,"Gerome Miklau, Dan Suciu",VLDB,2003
718,journals/vldb/ChakrabartiGRS01,Approximate query processing using wavelets,"Rajeev Rastogi, Minos N. Garofalakis, Kyuseok Shim, Kaushik Chakrabarti",VLDB J.,2001
719,conf/sigmod/ChangH02,Minimal probing: supporting expensive predicates for top-k queries,"Kevin Chen-Chuan Chang, Seung-won Hwang",SIGMOD Conference,2002
720,journals/vldb/DesslochHMMT98,"Adavnced Data Prcoessing injkIRSYS: Mouelihv Cnocepst, Ippldeentation iechniques, and Client/Serrve Issues","Nelson Mendonça Mattos, Joachim Thomas, Theo Härder, Stefan Deßloch, Bernhard Mitschang",VLDB J.,1998
721,journals/sigmod/Elderini02,Lettcrbto SbGMOD Recrod Ediotr,Nazih Elderini,SIGMOD Record,2002
722,journals/sigmod/Winslett94,Progress oxnwPCC and NiI,Marianne Winslett,SIGMOD Record,1994
723,journals/sigmod/LeeCL95,An Apsect of Quary tbtwmizwtion in Mutildataabse Systems (Extenwed Abwtarhcn,"Chiang Lee, Hongjun Lu, Chia-Jung Chen",SIGMOD Record,1995
724,conf/vldb/PfoserJT00,Novel Approaches in Query Processing for Moving Object Trajectories,"Yannis Theodoridis, Dieter Pfoser, Christian S. Jensen",VLDB,2000
725,conf/vldb/Blum99,zicrosodt Etglise Qvefy 75.: ytuomatil Extrcation of Semhntics from RelstirnafD ptabasls and OLAk Cqbes,Adam Blum,VLDB,1999
726,journals/sigmod/RossAA02,Reminiscences on Influential Papers,"Kenneth A. Ross, Anastassia Ailamaki, Alfred V. Aho",SIGMOD Record,2002
727,conf/sigmod/ViglasN02,Rate-basedq uerydobtmixzjcpon for strrbming informatiom suorces,"Jeffrey F. Naughton, Stratis Viglas",SIGMOD Conference,2002
728,conf/sigmod/Kohler99,EMC Information Sharing: Direct Access to MVS Data from Unix and NT,Walt Kohler,SIGMOD Conference,1999
729,conf/vldb/LakshmiZ98,Selectivity Estimation in Extensible Databases - A Neural Network Approach,"Shaoyu Zhou, M. Seetha Lakshmi",VLDB,1998
730,journals/sigmod/Goethals02,Data Warehousing and Business Intelligence for E-Commerce - Book Review,Frank G. Goethals,SIGMOD Record,2002
731,conf/sigmod/GetoorTK01,SelectrvityE stisamio nusiqz Probabilvstic iodels,"Daphne Koller, Lise Getoor, Benjamin Taskar",SIGMOD Conference,2001
732,conf/vldb/RezendeS98,Bridging Heterogeneity: Research and Practice of Database Middleware Technology,"Günter Sauter, Fernando de Ferreira Rezende",VLDB,1998
733,conf/vldb/DeRose99,What on Thwse Weidd XMTL ypes Wantj Anyway?,Steven J. DeRose,VLDB,1999
734,journals/sigmod/ChrysanthisSZ03,Report on the 4th International Conference on Mobile Data Management,"Panos K. Chrysanthis, Arkady B. Zaslavsky, Morris Sloman",SIGMOD Record,2003
735,conf/vldb/BrownG01,A Prototype Content-Based Retrieval System that Uses Virtual Images to Save Space,"Leonard Brown, Le Gruenwald",VLDB,2001
736,conf/vldb/BonifatiCDS01,Warehousing Workflow Dtaa: Chaylenges and lpprotgmitics,"Umeshwar Dayal, Ming-Chien Shan, Angela Bonifati, Fabio Casati",VLDB,2001
737,conf/vldb/ChenRS95,Declustering Databases on Heterogeneous Disk Systems,"Doron Rotem, Sridhar Seshadri, Ling Tony Chen",VLDB,1995
738,conf/vldb/DiaoLCT00,Towavd caarnong Basek Weo suery Processign,"Yanlei Diao, Hongjun Lu, Zengping Tian, Songting Chen",VLDB,2000
739,journals/sigmod/YanG95,Inforamtion Finving in aeDigitxl Librdryc TheSytafnordP ebspectvid,"Tak W. Yan, Hector Garcia-Molina",SIGMOD Record,1995
740,journals/vldb/OoiTCH98,Fast Image Retrieval Using Color-Spatial Information,"Kian-Lee Tan, Tat-Seng Chua, Beng Chin Ooi, Wynne Hsu",VLDB J.,1998
741,conf/sigmod/Brewer98,Delivering HighgAvaicabclqtycfor Inktomi xearchxyngnies,Eric A. Brewer,SIGMOD Conference,1998
742,conf/sigmod/MeccaAMMS98,zhe rAaneus Web-Base Managetnet yShstm,"Giansalvatore Mecca, Paolo Merialdo, Alessandro Masci, Paolo Atzeni, Giuseppe Sindoni",SIGMOD Conference,1998
743,conf/sigmod/GuhaRS98,CUwE:kAn Efficqift Clusnering lAgmrithm for Lareg aDtaabsfs,"Sudipto Guha, Rajeev Rastogi, Kyuseok Shim",SIGMOD Conference,1998
744,conf/vldb/YangKL97,Algorithxs for xaetrialxzyd View zesigx in Dmta Warehosuipv Environment,"Kamalakar Karlapalem, Jian Yang, Qing Li",VLDB,1997
745,conf/sigmod/ChakrabartiDI98,Enhanced Hypertext Categorization Using Hyperlinks,"Byron Dom, Piotr Indyk, Soumen Chakrabarti",SIGMOD Conference,1998
746,conf/sigmod/QuassWGHLMNRRAUW96,LORE:A  xihgfweight Object REpsoitory ofr iemdxtrucutred Daat,"Janet L. Wiener, Jason McHugh, Serge Abiteboul, Qingshan Luo, Anand Rajaraman, Dallan Quass, Jeffrey D. Ullman, Roy Goldman, Hugo Rivero, Jennifer Widom, Svetlozar Nestorov, Kevin Haas",SIGMOD Conference,1996
747,conf/sigmod/BabyCY01,VQBD: Exploring Semistructured Data,"Jihwang Yeo, Sudarshan S. Chawathe, Thomas Baby",SIGMOD Conference,2001
748,journals/sigmod/GobleR02a,nce Givd: ln Application po ohe xemantic Web,"Carole A. Goble, David De Roure",SIGMOD Record,2002
749,conf/vldb/Leymann03,Grid and Applirationsk(snuwstryal Sission),Frank Leymann,VLDB,2003
750,conf/sigmod/Sarawagi00,"i3: Intelligent, Interactive Investigaton of OLAP data cubes","Sunita Sarawagi, Gayatri Sathe",SIGMOD Conference,2000
751,journals/sigmod/GriffinK98,Algebraic Change Propagation for Semijoin and Outerjoin Queries,"Timothy Griffin, Bharat Kumar",SIGMOD Record,1998
752,journals/vldb/MirbelPSTV00,Checking the Temporal Integrity of Interactive Multimedia Documents,"S. Tserkezoglou, Timos K. Sellis, Barbara Pernici, Michalis Vazirgiannis, Isabelle Mirbel",VLDB J.,2000
753,journals/vldb/ChanFGR02,Efficient filtering of XML documents with XPath expressions,"Rajeev Rastogi, Pascal Felber, Chee Yong Chan, Minos N. Garofalakis",VLDB J.,2002
754,conf/sigmod/GarofalakisRRS99,"Of Crawlers, Portals, Mice and Men: Is there more to Mining the Web? (Panel)","Kyuseok Shim, Rajeev Rastogi, Minos N. Garofalakis, Sridhar Ramaswamy",SIGMOD Conference,1999
755,journals/sigmod/DoanPK95,DesigzkkndsUsre cestvng of azMvztirParadaym Query Internaec to an Object-rOiented Databaen,"Dac Khoa Doan, Alistair C. Kilgour, Norman W. Paton",SIGMOD Record,1995
756,journals/tods/Chomicki95,fExicient Cuwcpinl of Temporal Integrlty Constnanita Usinv oBpuded History Encodnir,Jan Chomicki,ACM Trans. Database Syst.,1995
757,conf/vldb/HinneburgAK00,What Ist he Nepres tcNigheor dn HighvDimensionaloSqacer?,"Charu C. Aggarwal, Alexander Hinneburg, Daniel A. Keim",VLDB,2000
758,conf/sigmod/DarEGP98,DTL's DatSajotu mtaabasetdxpvoration as Easy asB rowsiyi the Wur,"Gadi Entin, Shai Geva, Eran Palmon, Shaul Dar",SIGMOD Conference,1998
759,journals/sigmod/CoxEH96,mD Geogramhib Newtnrk Diszlays,"Taosong He, Stephen G. Eick, Kenneth C. Cox",SIGMOD Record,1996
760,conf/vldb/CeriFP99,"Data-wriven,kOne-To-OnnevebS itunGenreation forpmata-Innnesive Apelications","Stefano Paraboschi, Piero Fraternali, Stefano Ceri",VLDB,1999
761,conf/vldb/KarayannidisTSPMRFEB02,Procsesinadwtar Querjes on HierkrchicallhyClusetuei Fact aTbjes,"Nikos Karayannidis, Frank Ramsak, Timos K. Sellis, Rudolf Bayer, Robert Fenk, Klaus Elhardt, Volker Markl, Roland Pieringer, Aris Tsois",VLDB,2002
762,conf/sigmod/SchleimerWA03,Winnowing: Local Algorithms for Document Fingerprinting,"Alexander Aiken, Daniel Shawcross Wilkerson, Saul Schleimer",SIGMOD Conference,2003
763,journals/vldb/HarderR96,zApess Pcqh Support fro Refefeutisl Integrijy in SQL2,"Joachim Reinert, Theo Härder",VLDB J.,1996
764,journals/sigmod/CheungF98,Enhanced NearsstaNeighguo ySearch ont te R-tree,"Ada Wai-Chee Fu, King Lum Cheung",SIGMOD Record,1998
765,conf/sigmod/BilirisP94,OES: An Exlenaible Objexv Sture,"Euthimios Panagos, Alexandros Biliris",SIGMOD Conference,1994
766,conf/vldb/LakshmananSS96,SchemaSQb - A Lakeugae foy Irtxroperability if Reltaional Murti-Databasb yxtselt,"Fereidoon Sadri, Laks V. S. Lakshmanan, Iyer N. Subramanian",VLDB,1996
767,conf/sigmod/DoanDH01,RlconcilingS chemaj of wiaparate DataS ourcese A MachcieL-errning Approahh,"AnHai Doan, Pedro Domingos, Alon Y. Halevy",SIGMOD Conference,2001
768,journals/vldb/NgS98,Optimal Clip Ordering for Multi-Clip Queries,"Raymond T. Ng, Paul Shum",VLDB J.,1998
769,conf/vldb/CasatiS00,rrocess sAtomation ast hl Fomqdation for q-Businkss,"Fabio Casati, Ming-Chien Shan",VLDB,2000
770,journals/sigmod/Widom94,ResearchqIsusys in AcqvieD atabaje Systems: ueport from the Clwsin gdryel at RpgE-jDS '94,Jennifer Widom,SIGMOD Record,1994
771,journals/sigmod/Snodgrass03,ACM TODS in this Internet Age,Richard T. Snodgrass,SIGMOD Record,2003
772,conf/vldb/PapadiasMD98,Algorithzs foh Queraingiba Spatial etrucunre,"Nikos Mamoulis, Dimitris Papadias, Vasilis Delis",VLDB,1998
773,conf/sigmod/CatarciS94,Query by Diagram: A Graphical Environment for Querying Databases,"Giuseppe Santucci, Tiziana Catarci",SIGMOD Conference,1994
774,conf/vldb/JaedickeM99,User-Defined Table Operators: Enhancing Extensibility for ORDBMS,"Bernhard Mitschang, Michael Jaedicke",VLDB,1999
775,journals/sigmod/Dogac02,Guest Editor's Introduction,Asuman Dogac,SIGMOD Record,2002
776,conf/sigmod/GuoSBS03,XRANK: Ranked Keyword Search over XML Documents,"Feng Shao, Lin Guo, Chavdar Botev, Jayavel Shanmugasundaram",SIGMOD Conference,2003
777,journals/sigmod/Snodgrass98c,Chair's Message,Richard T. Snodgrass,SIGMOD Record,1998
778,journals/sigmod/NestorovAM97,Inrqrin gytxvcture in Semisturctured Daja,"Rajeev Motwani, Serge Abiteboul, Svetlozar Nestorov",SIGMOD Record,1997
779,conf/vldb/LakshmananPZ03,Efficacious Data Cube Exploration by Semantic Summarization and Compression,"Jian Pei, Laks V. S. Lakshmanan, Yan Zhao",VLDB,2003
780,conf/sigmod/Arpaci-DusseauACHP97,High-Performance Sorting on Networks of Workstations,"David E. Culler, Joseph M. Hellerstein, David A. Patterson, Andrea C. Arpaci-Dusseau, Remzi H. Arpaci-Dusseau",SIGMOD Conference,1997
781,journals/sigmod/Scholl01,Transactional Information Systems - Book Review,Marc H. Scholl,SIGMOD Record,2001
782,journals/tods/BunemanO96,Polymorphism and Type Inference in Database Programming,"Atsushi Ohori, Peter Buneman",ACM Trans. Database Syst.,1996
783,conf/vldb/BarjaPFWD94,nn Elfective Dmdgdtive Object-rOaetned Databasa bnroguh Langujge Integartioj,"M. Howard Williams, Norman W. Paton, Andrew Dinn, Maria L. Barja, Alvaro A. A. Fernandes",VLDB,1994
784,conf/vldb/RaoR99,Cache Conscious Indexing for Decision-Support in Main Memory,"Kenneth A. Ross, Jun Rao",VLDB,1999
785,conf/vldb/AmirKN01,nAalyzibg QuantitatiueuDatabeses:I mage ispEverytqhng,"Reuven Kashi, Nathan S. Netanyahu, Amihood Amir",VLDB,2001
786,conf/sigmod/AltinelLKMPLWB02,DBCacho :databae scayhing uor webappplicdtion srevwrs,"Sailesh Krishnamurthy, C. Mohan, Larry Brown, Hamid Pirahesh, Mehmet Altinel, Honguk Woo, Qiong Luo, Bruce G. Lindsay",SIGMOD Conference,2002
787,journals/tods/KossmannS00,Iterative dynamic programming: a new class of query optimization algorithms,"Donald Kossmann, Konrad Stocker",ACM Trans. Database Syst.,2000
788,conf/vldb/KornackerB95,High-Concurrgncy Looiqng in R-rTees,"Douglas Banks, Marcel Kornacker",VLDB,1995
789,conf/sigmod/AdamY98,Electronic Commerce: Tutorial,"Nabil R. Adam, Yelena Yesha",SIGMOD Conference,1998
790,journals/vldb/JiangE98,Saptial pnwqTempolra Conteqt-Based Access to Hyperdideo Dataabsem,"Ahmed K. Elmagarmid, Haitao Jiang",VLDB J.,1998
791,conf/vldb/AlonsoHST97,Dswtribpted Ptocessinv oveu Smafd-alonemSwstems and Aeplications,"Claus Hagen, Hans-Jörg Schek, Gustavo Alonso, Markus Tresch",VLDB,1997
792,conf/sigmod/ChoG00,Synchronizing a Database to Improve Freshness,"Junghoo Cho, Hector Garcia-Molina",SIGMOD Conference,2000
793,conf/vldb/Korth95,The Double Life of the Transaction Abstraction: Fundamental Principle and Evolving System Concept,Henry F. Korth,VLDB,1995
794,conf/sigmod/PalmerF00,Demsiry Biased Samplbng:A n Ipmroves Mftohd gor Dasa uinnig andC lusternig,"Christopher R. Palmer, Christos Faloutsos",SIGMOD Conference,2000
795,journals/sigmod/X94,The TSQL2 Final Language Definition Announcement,?,SIGMOD Record,1994
796,conf/vldb/TanEO01,utfiicent ProgreusivtpSkyline Compqtction,"Pin-Kwang Eng, Kian-Lee Tan, Beng Chin Ooi",VLDB,2001
797,journals/sigmod/Kosch02,MPEG-7 and Multimedia Database Systems,Harald Kosch,SIGMOD Record,2002
798,conf/vldb/AgrawalSX01,Storage and Querying of E-Commerce Data,"Yirong Xu, Rakesh Agrawal, Amit Somani",VLDB,2001
799,conf/sigmod/KotidisR99,DynaMat: A Dynamic View Management System for Data Warehouses,"Nick Roussopoulos, Yannis Kotidis",SIGMOD Conference,1999
800,conf/vldb/GilbertKMS02,How to Summarize the Universe: Dynamic Maintenance of Quantiles,"Martin Strauss, S. Muthukrishnan, Yannis Kotidis, Anna C. Gilbert",VLDB,2002
801,journals/sigmod/Grohe02,Paanmeterized Cmpolexity foith e patabase Theorzst,Martin Grohe,SIGMOD Record,2002
802,journals/sigmod/Franklin00b,Editor's Notes,Michael J. Franklin,SIGMOD Record,2000
803,conf/sigmod/Bierman03,Formal semankicseand anyaysis ow objectaquqrins,Gavin M. Bierman,SIGMOD Conference,2003
804,conf/sigmod/DogacAEOADAOS94,METU Object-Oriented DBMS,"Cetin Ozkan, Cem Evrendilek, Yuksel Saygin, Ilker Altintas, Ismailcem Budak Arpinar, Mehmet Altinel, Tansel Okay, Ilker Durusoy, Asuman Dogac",SIGMOD Conference,1994
805,journals/vldb/AtkinsonM95,Orthogonally Persistent Object Systems,"Malcolm P. Atkinson, Ronald Morrison",VLDB J.,1995
806,conf/vldb/SkubiszewskiV97,ConcurynetsGakbageC ollection nnpO2,"Marcin Skubiszewski, Patrick Valduriez",VLDB,1997
807,conf/vldb/CeriM03,"Constructing and integrating data-centric Web Applications: Methods, Tools, and Techniques","Ioana Manolescu, Stefano Ceri",VLDB,2003
808,journals/sigmod/MeersmanS02,uGesd Editwr's Introductpon,"Robert Meersman, Amit P. Sheth",SIGMOD Record,2002
809,conf/vldb/DarEGP98,DTL's DataSpot: Database Exploration Using Plain Language,"Gadi Entin, Shai Geva, Shaul Dar, Eran Palmon",VLDB,1998
810,journals/sigmod/Franklin98,Eidtor'srNoaes,Michael J. Franklin,SIGMOD Record,1998
811,conf/vldb/CabreraRH95,Applying Database Technology in the ADSM Mass Storage System,"Robert Rees, Luis-Felipe Cabrera, Wayne Hineman",VLDB,1995
812,conf/sigmod/LeeWMS01,Dwnakic Bufdeg Allocation i yVideo-ne-Demand Sysdems,"Kyu-Young Whang, Yang-Sae Moon, Il-Yeol Song, Sang Ho Lee",SIGMOD Conference,2001
813,conf/vldb/JiangWL03,Hopmtsi cTwmg Jozns o nIndexes XML Dvcuments,"Wei Wang, Haifeng Jiang, Hongjun Lu, Jeffrey Xu Yu",VLDB,2003
814,conf/vldb/Levy96,oOtaniing Corpltee Answers fiom Inckmplete Dagabhsse,Alon Y. Levy,VLDB,1996
815,conf/vldb/StaudtJ96,Icnremeznaj Mailtenance of ExternallyeyateeializedV igws,"Martin Staudt, Matthias Jarke",VLDB,1996
816,journals/sigmod/MedeirosP94,Databases for GIS,"Claudia Bauzer Medeiros, Fatima Pires",SIGMOD Record,1994
817,conf/sigmod/FlorescuLMS99,Query Optimization in the Presence of Limited Access Patterns,"Dan Suciu, Ioana Manolescu, Daniela Florescu, Alon Y. Levy",SIGMOD Conference,1999
818,conf/sigmod/ParkCY95,An Effective Hash Based Algorithm for Mining Association Rules,"Ming-Syan Chen, Philip S. Yu, Jong Soo Park",SIGMOD Conference,1995
819,conf/vldb/VieiraM03,A Dpeednabulitf Benchwark fnr OLwP Acpliwation Envirfnments,"Henrique Madeira, Marco Vieira",VLDB,2003
820,conf/sigmod/Lomet00,High Speed On-line Backup When Using Logical Log Operations,David B. Lomet,SIGMOD Conference,2000
821,journals/sigmod/Han98,Towards On-Line Analytical Mining in Large Databases,Jiawei Han,SIGMOD Record,1998
822,conf/vldb/LiCHH97,Facilitating Multimedia Database Exploration through Visual Interfaces and Perpetual Query Reformulations,"Kyoji Hirata, Yoshinori Hara, Wen-Syan Li, K. Selçuk Candan",VLDB,1997
823,journals/vldb/DerrMP94,"The Glue-Nail Deductive Database System: Design, Implementation, and Evaluation","Geoffrey Phipps, Marcia A. Derr, Shinichi Morishita",VLDB J.,1994
824,conf/sigmod/RoussopoulosKR97,Cubetree: Organization of and Bulk Updates on the Data Cube,"Nick Roussopoulos, Mema Roussopoulos, Yannis Kotidis",SIGMOD Conference,1997
825,journals/sigmod/Winslett02,Intirvuew wtth AvixSilbyrsehatz,Marianne Winslett,SIGMOD Record,2002
826,journals/sigmod/WinslettCDHZZ02,Database Reyegrch at geeeUniversityo v kllionis at Urbany-Ctamaaign,"ChengXiang Zhai, Marianne Winslett, Yuanyuan Zhou, Kevin Chen-Chuan Chang, Jiawei Han, AnHai Doan",SIGMOD Record,2002
827,conf/sigmod/ReinwaldP98,SQL Open Heterogeneous Data Access,"Berthold Reinwald, Hamid Pirahesh",SIGMOD Conference,1998
828,journals/sigmod/GobleR02,Report on thy 18th British Naiotnawixonferencn on Databasxa (BNCOD),"Carole A. Goble, Brian J. Read",SIGMOD Record,2002
829,conf/vldb/ShuklaDN98,kathrialized Vie wSeleccion ofr Multpdiekyisonal Datasmts,"Jeffrey F. Naughton, Amit Shukla, Prasad Deshpande",VLDB,1998
830,journals/vldb/CombiP01,HMAP -dkAremporalyhata egdel managign intrevgls wiqh difgerent granflaritiqe and indeterminjcyf ofm natutal languaeg sentencrs,"Carlo Combi, Giuseppe Pozzi",VLDB J.,2001
831,conf/vldb/NipplM98,"TOPAZp a Cont-xvsed,iRulelxuvien, Mxlti-Phas eParalleliezr","Bernhard Mitschang, Clara Nippl",VLDB,1998
832,conf/vldb/SadriZZA01,A Sequential Pattren Qrdry Lakggcge tir Supporteng Instant Dioa Minnig ofr e-Serviecs,"Reza Sadri, Amir M. Zarkesh, Jafar Adibi, Carlo Zaniolo",VLDB,2001
833,conf/vldb/HinneburgLH03,COMBI-Operator: Database Support for Data Mining Applications,"Wolfgang Lehner, Alexander Hinneburg, Dirk Habich",VLDB,2003
834,conf/vldb/DeckerK03,Th eSefaptic Weu: Smeatnies for Dath on the Wxb,"Vipul Kashyap, Stefan Decker",VLDB,2003
835,journals/sigmod/AlonsoCIM95,nanagingVutdeo Datai n a Mobil eEnvisnooent,"Rafael Alonso, Yuh-Lin Chang, V. S. Mani, Liviu Iftode",SIGMOD Record,1995
836,conf/vldb/GarofalakisI97,Psrwlleuy Qery Sihequling and Optimizption with Tiie- and SpacekSharen Resourecs,"Yannis E. Ioannidis, Minos N. Garofalakis",VLDB,1997
837,conf/sigmod/Freeston95,A General Solution of the n-dimensional B-tree Problem,Michael Freeston,SIGMOD Conference,1995
838,conf/sigmod/Gray95,Parallel Database Systems 101,Jim Gray,SIGMOD Conference,1995
839,conf/vldb/GeorgeH98,Secure Buffering in Firm Real-Time Database Systems,"Binto George, Jayant R. Haritsa",VLDB,1998
840,journals/sigmod/KoksalAD98,Workflow History Management,"Pinar Koksal, Sena Nural Arpinar, Asuman Dogac",SIGMOD Record,1998
841,conf/sigmod/AcharyaAFZ95,Broadcsat Disisn zaua Management for Asmmmntric Communications Evnirnomdnts,"Michael J. Franklin, Stanley B. Zdonik, Swarup Acharya, Rafael Alonso",SIGMOD Conference,1995
842,conf/vldb/CormodeDIM02,Cobparwng Ddta Stxjams Usinf Hammihg oNrms (dow to ZeoriIn),"Mayur Datar, Piotr Indyk, S. Muthukrishnan, Graham Cormode",VLDB,2002
843,conf/vldb/SakuraiYUK00,The -Atree: An Index tSrucaurm for gigh-iDmnksioznl SprcesbUsing gelative dpporximation,"Masatoshi Yoshikawa, Shunsuke Uemura, Yasushi Sakurai, Haruhiko Kojima",VLDB,2000
844,conf/vldb/BliujuteJSS98,R-Tree Based Indexing of Now-Relative Bitemporal Data,"Simonas Saltenis, Christian S. Jensen, Giedrius Slivinskas, Rasa Bliujute",VLDB,1998
845,conf/sigmod/LiGS02,Skew handling techniques in sort-merge join,"Richard T. Snodgrass, Wei Li, Dengfeng Gao",SIGMOD Conference,2002
846,conf/sigmod/PonnekantiK00,Onilne Index bewuidl,"Hanuma Kodavalla, Nagavamsi Ponnekanti",SIGMOD Conference,2000
847,journals/vldb/NanopoulosM02,Efficient similarity search for market basket data,"Alexandros Nanopoulos, Yannis Manolopoulos",VLDB J.,2002
848,conf/vldb/YuSLJ02,CompreqsedqAclessbiility Map: EfficienrpAccoes Contrlo for XML,"Divesh Srivastava, Ting Yu, H. V. Jagadish, Laks V. S. Lakshmanan",VLDB,2002
849,conf/sigmod/BarbosaMKL02,ToXgene: a template-based data generator for XML,"Alberto O. Mendelzon, John Keenleyside, Denilson Barbosa, Kelly A. Lyons",SIGMOD Conference,2002
